commit	val_acc	val_auc	val_f1	memory_gb	status	config	description
feba55e	0.872340	0.946818	0.872340	2.2	discard	formal	DFR-02-RESNEXT-DECISION-256X8-AUX-VIEW-LOSS-FORMAL-S42: decision-fusion-only repair on node19 reused the L3-no-mixer anchor and enabled per-view auxiliary CE via the existing _view_logits/_log_vars hook under ANKLE_DISABLE_FUSION_CROSS_VIEW_MIXER=1 and ANKLE_DECISION_ENABLE_AUX_VIEW_LOSS=1; best summary reached 0.872340/0.946818/0.872340, improving DFR-01 AUC but still trailing the retained L3-no-mixer seed42 anchor 0.925532/0.977727/0.921348
ecf7d47	0.904255	0.960000	0.898876	2.2	discard	formal	DFR-03-RESNEXT-DECISION-256X8-VIEW-ROBUSTNESS-FORMAL-S42: decision-fusion-only repair on node19 kept the L3-no-mixer anchor fixed and added train-time single-view dropout plus axial avg-pool blur under ANKLE_DISABLE_FUSION_CROSS_VIEW_MIXER=1; best summary reached 0.904255/0.960000/0.898876, clearly outperforming DFR-01 and DFR-02 but still trailing the retained L3-no-mixer seed42 anchor 0.925532/0.977727/0.921348
70d22ac	0.925532	0.977727	0.915663	2.1	discard	formal	DFR-04-RESNEXT-DECISION-256X8-BOUNDED-GATING-FORMAL-S42: decision-fusion-only repair on node19 kept the L3-no-mixer anchor fixed and added a late-fusion minimum-weight floor under ANKLE_DISABLE_FUSION_CROSS_VIEW_MIXER=1 and ANKLE_DECISION_FUSION_WEIGHT_FLOOR=0.10; best summary exactly tied the retained anchor on val_acc/val_auc but trailed it on val_f1 and simplicity, so it records as a promising discard
0415da9	0.946809	0.973636	0.942529	2.1	keep	formal	DFR-05-RESNEXT-DECISION-256X8-BOUNDED-GATING-FLOOR05-FORMAL-S42: decision-fusion-only repair on node19 kept the no-mixer anchor fixed and used a milder late-fusion minimum-weight floor under ANKLE_DISABLE_FUSION_CROSS_VIEW_MIXER=1 and ANKLE_DECISION_FUSION_WEIGHT_FLOOR=0.05; best summary improved the retained L3-no-mixer seed42 anchor by 0.021277 val_acc and 0.021180 val_f1, establishing the first positive keep on the bounded-gating line
36d99ee	0.946809	0.973636	0.942529	2.1	discard	formal	DFR-06-RESNEXT-DECISION-256X8-BOUNDED-GATING-FLOOR05-TELEMETRY: analyzed the DFR-05 winner checkpoint and found top-weight distribution diversified from axial-only to axial=57/coronal=37/sagittal=0 with mean weights 0.5558/0.3920/0.0522; this is a mechanism-side validation only, so it does not create a new retained checkpoint
102460a	0.925532	0.980909	0.921348	2.1	keep	formal	DFR-07-RESNEXT-DECISION-256X8-BOUNDED-GATING-FLOOR05-CONFIRM-FORMAL-S42: exact confirmation on node19 matched the retained L3-no-mixer seed42 val_acc and val_f1 while improving val_auc by 0.003182, but it did not reproduce the larger DFR-05 0.946809 val_acc spike
3f7bc35	0.861702	0.926364	0.843373	2.1	discard	formal	DFR-08-RESNEXT-DECISION-256X8-BOUNDED-GATING-FLOOR05-FORMAL-S123: alternate-seed validation on node20 showed the floor=0.05 bounded-gating line regressed against matched L3-no-mixer seed123 by 0.031915 val_acc and 0.013182 val_auc, so the mechanism is not stable across seeds
3f7bc35	0.936170	0.969091	0.928571	2.1	keep	formal	DFR-09-RESNEXT-DECISION-256X8-BOUNDED-GATING-FLOOR05-FORMAL-S456: alternate-seed validation on node20 improved matched L3-no-mixer seed456 by 0.010638 val_acc and 0.010924 val_f1 with only a 0.002273 val_auc tradeoff, showing bounded-gating still has local seed-level value
a8994ea	0.914894	0.974545	0.911111	2.1	discard	formal	DFR-11-RESNEXT-DECISION-256X8-VIEW-LOGIT-TEMPERATURE-FORMAL-S42: node20 single-card formal kept L3-no-mixer no-mixer semantics and added per-view global logit temperature calibration under ANKLE_DECISION_ENABLE_VIEW_LOGIT_TEMPERATURE=1; it briefly touched 0.914894 val_acc with better AUC/F1 than DFR-12, but still trailed the retained seed42 anchor by 0.010638 val_acc
a8994ea	0.914894	0.973182	0.900000	2.1	discard	formal	DFR-12-RESNEXT-DECISION-256X8-TEACHER-GUIDED-GATE-FORMAL-S42: node20 single-card formal layered a 0.30 detached teacher blend on top of DFR-11 calibration, tied DFR-11 on best val_acc, but lost 0.001364 val_auc and 0.011111 val_f1 while remaining below the retained seed42 anchor
747c1c9	0.925532	0.977727	0.921348	1.2	discard	formal	DFR-13-RESNEXT-DECISION-256X8-STAGEWISE-GATE-FORMAL-S42: stagewise node20 formal initialized from the retained L3-no-mixer seed42 checkpoint and unfreezed only confidence_heads plus confidence_calibrator; best stayed at the init checkpoint while later epochs regressed to 0.829787 val_acc, so gate-only fine-tuning added no value
06fe604	0.925532	0.977727	0.921348	1.3	discard	formal	DFR-14-RESNEXT-DECISION-256X8-STAGEWISE-GATE-ROBUSTNESS-FORMAL-S42: stagewise node20 formal kept the same frozen expert checkpoint and gate-only trainable set but added view-dropout plus axial-blur robustness; best still stayed at epoch0 and later epochs regressed harder, so robustness could not rescue the frozen-expert regime
06fe604	0.925532	0.977727	0.921348	1.2	discard	formal	DFR-15-RESNEXT-DECISION-256X8-STAGEWISE-GATE-FLOOR05-FORMAL-S42: stagewise node20 formal reused the same init checkpoint and trainable gate subset while applying late-fusion floor=0.05; best again stayed at the inherited checkpoint and the run degraded after training, so bounded gating alone does not help when experts stay frozen
80e0557	0.925532	0.978182	0.923077	2.1	keep	formal	DFR-16-RESNEXT-DECISION-256X8-SINGLE-VIEW-AXIAL-FORMAL-S42: direct masked single-view axial expert training on the decision-fusion scaffold matched the retained L3-no-mixer seed42 val_acc while improving val_auc and val_f1 over the FWR axial control, making it the retained axial expert for the two-stage line
80e0557	0.893617	0.937273	0.886364	2.1	keep	formal	DFR-17-RESNEXT-DECISION-256X8-SINGLE-VIEW-CORONAL-FORMAL-S42: direct masked single-view coronal expert training recovered far beyond the FWR coronal control and produced a genuinely useful standalone coronal expert, showing the view was starved rather than information-free
80e0557	0.861702	0.904091	0.835443	2.1	keep	formal	DFR-18-RESNEXT-DECISION-256X8-SINGLE-VIEW-SAGITTAL-FORMAL-S42: direct masked single-view sagittal expert training also recovered strongly over the FWR sagittal control, confirming sagittal starvation under joint late-fusion training rather than an inherently useless view
77cb402	0.904255	0.974091	0.901099	1.2	discard	formal	DFR-19-RESNEXT-DECISION-256X8-MERGED-EXPERTS-GATE-WARMUP-FORMAL-S42: merged the retained axial/coronal/sagittal single-view experts back into one multi-view decision model and warmed up only confidence_heads plus confidence_calibrator; the merged init itself reached 0.904255 val_acc, and all fine-tune epochs stayed below that starting point, so gate-only realignment is not sufficient
86df7d9	0.904255	0.974091	0.901099	20.8	discard	formal	DFR-20-RESNEXT-DECISION-256X8-MERGED-EXPERTS-JOINT-FINETUNE-FORMAL-S42: joint finetuned the merged single-view expert initialization with view_encoders, view_classifiers, and gate parameters all trainable at lr=5e-5; best still stayed at the merged init checkpoint and never recovered the retained L3-no-mixer seed42 level
156c6a1	0.904255	0.974091	0.901099	1.2	discard	formal	DFR-21-RESNEXT-DECISION-256X8-MERGED-EXPERTS-CLASSIFIER-GATE-FINETUNE-FORMAL-S42: kept merged single-view encoders frozen and only finetuned view_classifiers plus confidence_heads plus confidence_calibrator; best again stayed at the merged init checkpoint, so classifier/gate-only realignment still did not recover the retained seed42 anchor
bf4256e	0.936170	0.978636	0.933333	2.1	keep	formal	DFR-25-RESNEXT-DECISION-256X8-DOMINANT-GATE-DROPOUT-MAIN-S42: adaptive main-study on retry1 kept L3-no-mixer semantics and added train-time dominant-gate dropout under ANKLE_DECISION_TRAIN_DOMINANT_GATE_DROPOUT_PROB=0.25; best completed trial (lr=1e-4, wd=2.5e-4, dropout=0.25, clip=2.5) reached 0.936170/0.978636/0.933333, beating matched equal-weight and L3-no-mixer seed42 by +0.010638 val_acc
8085b55	0.936170	0.955455	0.931818	2.1	keep	formal	DFR-25-RESNEXT-DECISION-256X8-DOMINANT-GATE-DROPOUT-MAIN-S123: fresh adaptive single-trial main-study exact confirmation kept L3-no-mixer semantics and ANKLE_DECISION_TRAIN_DOMINANT_GATE_DROPOUT_PROB=0.25 with the seed42-winning scalar (lr=1e-4, wd=2.5e-4, dropout=0.25, clip=2.5); reached 0.936170/0.955455/0.931818, beating matched equal-weight seed123 by +0.010638 val_acc and L3-no-mixer seed123 by +0.042553 val_acc
3fb1e11	0.946809	0.969091	0.942529	2.1	keep	formal	DFR-25-RESNEXT-DECISION-256X8-DOMINANT-GATE-DROPOUT-MAIN-S456: fresh adaptive single-trial main-study exact confirmation kept L3-no-mixer semantics and ANKLE_DECISION_TRAIN_DOMINANT_GATE_DROPOUT_PROB=0.25 with the seed42-winning scalar (lr=1e-4, wd=2.5e-4, dropout=0.25, clip=2.5); reached 0.946809/0.969091/0.942529, beating matched equal-weight seed456 by +0.031915 val_acc and L3-no-mixer seed456 by +0.021277 val_acc
4eddcd3	0.939716	0.967727	0.935893	2.1	discard	formal	DFR-25-RESNEXT-DECISION-256X8-DOMINANT-GATE-DROPOUT-MULTISEED-ROUTING-TELEMETRY: analyzed retained main-study seeds 42/123/456 with fusion-weight, matched view-control, and axial-blur telemetry; mean full-fusion still beat the best single-view by 0.028369 val_acc, but axial top-weight remained 0.840426 on average and axial-blur migrated away only 0.053191, so routing repair is real but still incomplete
9ca2de1	0.936170	0.980000	0.930233	2.1	keep	formal	DFR-26-RESNEXT-DECISION-256X8-NONDOMINANT-WEIGHT-FLOOR-MAIN-S42: adaptive main-study on iter_0005 kept L3-no-mixer plus dominant-gate-dropout and added ANKLE_DECISION_TRAIN_NONDOMINANT_WEIGHT_FLOOR=0.05; best completed trial 1 matched DFR-25 seed42 on val_acc while improving val_auc to 0.980000 and stayed above matched equal-weight seed42
4c8328b	0.840426	0.919091	0.827586	2.1	discard	formal	DFR-26-RESNEXT-DECISION-256X8-NONDOMINANT-WEIGHT-FLOOR-MAIN-S123: fresh adaptive single-trial main-study exact confirmation kept L3-no-mixer plus dominant-gate-dropout and ANKLE_DECISION_TRAIN_NONDOMINANT_WEIGHT_FLOOR=0.05 with the seed42-winning scalar (lr=1e-4, wd=2.5e-4, dropout=0.25, clip=2.5); collapsed to 0.840426/0.919091/0.827586 on seed123, falling well below matched equal-weight and the DFR-25 seed123 winner
1176eb2	0.936170	0.965909	0.931818	2.1	discard	formal	DFR-27-RESNEXT-DECISION-256X8-CONDITIONAL-AXIAL-DOMINANCE-FLOOR-MAIN-S42: adaptive main-study on iter_0007 kept L3-no-mixer plus dominant-gate-dropout and floor=0.05 but only triggered it when axial fusion weight exceeded 0.8; best completed trial 3 matched the retained seed42 val_acc at 0.936170 yet dropped to val_auc 0.965909, so it stayed above matched equal-weight but lost the tie-break to DFR-25/26
5f75da6	0.936170	0.977273	0.933333	2.1	discard	formal	DFR-28-RESNEXT-DECISION-256X8-CONTINUOUS-AXIAL-DOMINANCE-SCALED-RESCUE-MAIN-S42: adaptive main-study on iter_0008 kept L3-no-mixer plus dominant-gate-dropout and floor=0.05 but changed the axial-threshold rescue from hard gating to dominance-excess-scaled blending; best completed trial 1 recovered the retained seed42 winning corner at 0.936170/0.977273/0.933333, staying above matched equal-weight yet still losing the tie-break to DFR-26 and DFR-25 on val_auc
72f0bf3	0.914894	0.983636	0.909091	2.1	discard	formal	DFR-29-RESNEXT-DECISION-256X8-REDUCED-CONTINUOUS-RESCUE-SCALE-MAIN-S42: adaptive main-study on iter_0009 kept DFR-28 continuous axial-dominance rescue semantics but halved the max rescue strength with ANKLE_DECISION_TRAIN_NONDOMINANT_RESCUE_SCALE=0.5; all 6 completed trials collapsed to 0.914894 val_acc, including the prior winning corner, so lower-cap rescue is a clear regression below matched equal-weight seed42
ef48be9	0.925532	0.977273	0.921348	2.1	discard	formal	DFR-30-RESNEXT-DECISION-256X8-AXIAL-TOP12-MARGIN-TRIGGER-MAIN-S42: adaptive main-study on iter_0010 kept DFR-25 plus floor=0.05 but replaced the rescue trigger with ANKLE_DECISION_TRAIN_AXIAL_TOP12_MARGIN_THRESHOLD=0.7; best completed trial 0 only reached 0.925532/0.977273/0.921348, tying matched equal-weight seed42 on val_acc and falling short of retained DFR-25/26.
fbf46bf	0.914894	0.979091	0.909091	2.1	discard	formal	DFR-31-RESNEXT-DECISION-256X8-CONTINUOUS-TOP12-MARGIN-SCALED-RESCUE-MAIN-S42: adaptive main-study on iter_0011 kept DFR-25 plus floor=0.05 but replaced the hard top1-top2 trigger with ANKLE_DECISION_TRAIN_AXIAL_TOP12_MARGIN_SCALE_THRESHOLD=0.4; all 6 completed trials stayed on the 0.9043/0.9149 platform and the best trial 0 reached only 0.914894/0.979091/0.909091, below matched equal-weight seed42 and retained DFR-25/26 keeps.
3b2d06e	0.925532	0.977727	0.923077	2.1	discard	formal	DFR-32-RESNEXT-DECISION-256X8-AXIAL-LOW-ENTROPY-TRIGGER-MAIN-S42: adaptive main-study on iter_0012 kept DFR-25 plus floor=0.05 but replaced the rescue trigger with ANKLE_DECISION_TRAIN_AXIAL_ENTROPY_THRESHOLD=0.65; best completed trial 4 only reached 0.925532/0.977727/0.923077, tying matched equal-weight seed42 on val_acc and staying below retained DFR-25/26 keeps.
318f7f0	0.904255	0.968636	0.896552	1.2	discard	formal	DFR-22-RESNEXT-DECISION-256X8-MERGED-EXPERTS-EQUAL-WEIGHT-FORMAL-S42: pure equal-weight control on the merged single-view experts stayed exactly at the merged init checkpoint (0.904255/0.968636/0.896552), showing that removing learned routing alone does not rescue the merged geometry
318f7f0	0.936170	0.974091	0.931818	1.2	keep	formal	DFR-23-RESNEXT-DECISION-256X8-MERGED-EXPERTS-EQUAL-WEIGHT-CLASSIFIER-FINETUNE-FORMAL-S42: original node15 job 435849 timed out because same-node triple concurrency made eval/train batches stall, but isolated formalization of the saved best.pt on node20 reproduced a stable 0.936170/0.974091/0.931818, confirming classifier-only realignment under fixed equal-weight is the one positive line in this family
23c7a4d	0.904255	0.968636	0.896552	7.7	discard	formal	DFR-24-RESNEXT-DECISION-256X8-MERGED-EXPERTS-EQUAL-WEIGHT-JOINT-FINETUNE-FORMAL-S42: full encoder+classifier joint realignment needed batch_size=2 to avoid OOM on the 49GB Ada card, yet even after the successful rerun best still stayed at the merged init checkpoint 0.904255/0.968636/0.896552
1c1900d	0.925532	0.982727	0.917647	2.1	discard	formal	DFR-33-RESNEXT-DECISION-256X8-CONTINUOUS-LOW-ENTROPY-SCALING-MAIN-S42: adaptive main-study on iter_0013 kept DFR-25 plus floor=0.05 but replaced the hard entropy trigger with ANKLE_DECISION_TRAIN_AXIAL_ENTROPY_SCALE_THRESHOLD=0.65; best completed trial 4 only reached 0.925532/0.982727/0.917647, tying matched equal-weight seed42 on val_acc and staying below retained DFR-25/26 keeps.
dbdc290	0.925532	0.981364	0.926316	2.1	discard	formal	DFR-34-RESNEXT-DECISION-256X8-TARGETED-STRONGEST-FALLBACK-RESCUE-MAIN-S42: adaptive main-study on iter_0014 kept DFR-25 plus floor=0.05 but concentrated the full training-only rescue mass onto the current strongest non-dominant gate view via ANKLE_DECISION_TRAIN_TARGET_TOP_NONDOMINANT_RESCUE=1; best completed trial 5 only reached 0.925532/0.981364/0.926316, tying matched equal-weight seed42 on val_acc and staying below retained DFR-25/26 keeps.
6a20314	0.925532	0.981364	0.917647	2.1	discard	formal	DFR-35-RESNEXT-DECISION-256X8-DETACHED-TEACHER-EVIDENCE-TARGETED-RESCUE-MAIN-S42: adaptive main-study on iter_0015 kept DFR-25 plus floor=0.05 but switched rescue target selection from gate-ranked fallback to ANKLE_DECISION_TRAIN_TARGET_TEACHER_NONDOMINANT_RESCUE=1; best completed trial 2 only reached 0.925532/0.981364/0.917647, tying matched equal-weight seed42 on val_acc and staying below retained DFR-25/26 keeps.
c3e881b	0.914894	0.939091	0.902439	2.1	discard	formal	DFR-36-RESNEXT-DECISION-256X8-TEACHER-GUIDED-DROPOUT-REDISTRIBUTION-MAIN-S42: adaptive main-study on iter_0001 kept DFR-25 dominant-gate dropout but rerouted dropped dominant gate mass to the detached teacher-selected strongest fallback via ANKLE_DECISION_TRAIN_TARGET_TEACHER_DROPOUT_REDISTRIBUTION=1; best completed trial 4 only reached 0.914894/0.939091/0.902439, staying below matched equal-weight seed42 and retained DFR-25/26 keeps.
e48302a	0.936170	0.974545	0.931818	2.1	discard	formal	DFR-37-RESNEXT-DECISION-256X8-MISALIGNMENT-CONDITIONED-DOMINANT-DROPOUT-MAIN-S42: adaptive main-study on iter_0002 kept DFR-25 dominant-gate dropout but only fired it when ANKLE_DECISION_TRAIN_AXIAL_TEACHER_MISALIGNMENT_THRESHOLD=0.1 and gate axial weight clearly exceeded detached teacher evidence; best completed trial 0 reached 0.936170/0.974545/0.931818, beating matched equal-weight seed42 on val_acc but tying retained DFR-25/26 val_acc with lower AUC, so discard.
6ce6405	0.925532	0.974091	0.923077	2.1	discard	formal	DFR-38-RESNEXT-DECISION-256X8-CONTINUOUS-MISALIGNMENT-SCALED-DOMINANT-DROPOUT-MAIN-S42: adaptive main-study on iter_0003 kept DFR-25 dominant-gate dropout but replaced DFR-37 hard mismatch eligibility with ANKLE_DECISION_TRAIN_AXIAL_TEACHER_MISALIGNMENT_SCALE_THRESHOLD=0.1 so dropout probability scaled with gate-teacher axial misalignment; best completed trial 4 reached only 0.925532/0.974091/0.923077, tying matched equal-weight seed42 and failing to recover the DFR-37/DFR-25 ceiling.
cbb77a1	0.925532	0.977273	0.917647	2.1	discard	formal	DFR-39-RESNEXT-DECISION-256X8-HARD-GATED-MISALIGNMENT-EXCESS-SCALED-DOMINANT-DROPOUT-MAIN-S42: adaptive main-study on iter_0004 kept DFR-37 hard mismatch eligibility and DFR-25 dominant-gate-dropout but scaled flattening strength within already-eligible samples via ANKLE_DECISION_TRAIN_AXIAL_TEACHER_MISALIGNMENT_EXCESS_SCALE_WINDOW=0.05; best completed trial 4 reached only 0.925532/0.977273/0.917647 and fusion telemetry collapsed back to axial mean weight 0.935915 with 94/94 axial top-weight, so it failed to recover the DFR-37/DFR-25 ceiling.
94c4dcf	0.914894	0.980909	0.909091	2.1	discard	formal	DFR-40-RESNEXT-DECISION-256X8-TEACHER-NONAXIAL-TOP-HARD-MISMATCH-DROPOUT-MAIN-S42: adaptive main-study on iter_0005 kept DFR-37 hard mismatch and full-strength dominant-dropout but added ANKLE_DECISION_TRAIN_REQUIRE_TEACHER_NONAXIAL_TOP=1 so correction only fired when detached teacher top-view was already non-axial; all 6 completed trials stayed on the 0.9043/0.9149 platform and best trial 1 re-collapsed to axial mean weight 0.961123 with 94/94 axial top-weight, so discard.
98804e1	0.925532	0.983182	0.917647	2.1	discard	formal	DFR-41-RESNEXT-DECISION-256X8-TEACHER-NONAXIAL-COMPETITIVE-GAP-HARD-MISMATCH-DROPOUT-MAIN-S42: adaptive main-study on iter_0006 kept DFR-37 hard mismatch and full-strength dominant-dropout but replaced DFR-40 teacher-top flip with ANKLE_DECISION_TRAIN_TEACHER_NONAXIAL_COMPETITIVE_GAP=0.2; best trial 2 only reached 0.925532/0.983182/0.917647 and fusion telemetry re-collapsed to axial mean weight 0.968893 with 94/94 axial top-weight, so discard.
1d816ab	0.914894	0.975455	0.904762	2.1	discard	formal	DFR-42-RESNEXT-DECISION-256X8-ADDITIVE-MISMATCH-DROPOUT-BOOST-MAIN-S42: adaptive main-study on iter_0007 kept DFR-25 dominant-gate dropout base coverage and added ANKLE_DECISION_TRAIN_AXIAL_TEACHER_MISALIGNMENT_DROPOUT_BOOST=0.25 for gate-teacher mismatch plus nonaxial-competitive samples; all 6 completed trials stayed at or below 0.914894 val_acc, and best trial 4 reached only 0.914894/0.975455/0.904762 with fusion weights 0.748/0.070/0.182 and top-weight 84/0/10, so discard.
2c803ab	0.925532	0.965455	0.921348	2.1	discard	formal	DFR-43-RESNEXT-DECISION-256X8-FALLBACK-DISAGREEMENT-ONLY-TEACHER-DROPOUT-REDISTRIBUTION-MAIN-S42: adaptive main-study on iter_0008 kept DFR-37 hard mismatch coverage but only let teacher-targeted redistribution override DFR-25 flattening when gate and teacher disagreed on the fallback view; best trial 0 reached only 0.925532/0.965455/0.921348, tying matched equal-weight seed42 while fusion weights re-collapsed to 0.923/0.074/0.003 with 94/94 axial top-weight, so discard.
5da110b	0.893617	0.950606	0.884048	2.2	discard	formal	DFR-44-RESNEXT-DECISION-256X8-EVIDENCE-AWARE-RESIDUAL-GATE-MULTISEED-FORMAL: 3-seed Slurm formal run on node16 GPUs 5/6/7 kept DFR-25 scalar/runtime and added an inference-time evidence-aware residual gate; mean fell below DFR-25 3-seed mean 0.939716/0.967727/0.935893 and below matched equal-weight mean, so this structure innovation is not retained.
ed6561c	0.914894	0.977273	0.911111	2.1	discard	formal	DFR-45-RESNEXT-DECISION-256X8-GATE-LOGIT-RMS-LIMIT-MAIN-S42: Slurm formal job 481787 kept DFR-25 scalar/runtime and added GateLogitRMSLimiter max_centered_rms=1.3; best epoch 9 reached 0.914894/0.977273/0.911111, below retained DFR-25 seed42 and below matched equal-weight seed42. Fusion telemetry job 481797 still showed mean weights 0.880/0.052/0.067 with top-weight axial=94/94, so limiting logit concentration did not repair routing-order collapse.
ba1c09d	0.925532	0.975455	0.915663	2.1	discard	formal	DFR-46-RESNEXT-DECISION-256X8-SHARED-CONFIDENCE-HEAD-MAIN-S42: Slurm formal job 481809 kept DFR-25 scalar/runtime and replaced three view-specific reliability heads with one shared confidence scorer; best reached 0.925532/0.975455/0.915663, tying matched equal-weight seed42 but below retained DFR-25 seed42. Fusion telemetry job 481813 still showed mean weights 0.895/0.061/0.044 with top-weight axial=94/94, so shared scoring alone did not change routing-order collapse.
