commit	val_acc	val_auc	val_f1	memory_gb	status	config	description
ae95cd3	0.914894	0.978182	0.909091	2.2	discard	formal	DFR-92-RESNEXT-DECISION-256X8-LOW-CORONAL-ABNORMAL-AUX-SEED42-MAIN-STUDY: 设计思路=after DFR91 showed coronal-only aux can make coronal classifier useful but still fails to move gate, lower aux weights to test whether 0.01+ was disturbing the DFR25 main path; 预计改进效果=lower coronal-only pressure should preserve DFR25 axial main accuracy while retaining enough coronal positive signal for near-top routing on coronal true-margin samples, potentially recovering above matched equal-weight seed42; 实验实际结果=fresh main-study runs/optuna_main_resnext_decision_256x8_dfr92_coronal_abnormal_aux_low completed seed42 low coronal-only aux weights 0.001/0.0025/0.005 with all val_acc 0.914894 and best trial1 val_auc 0.978182 val_f1 0.909091; fusion telemetry mean weights 0.8701/0.0743/0.0556 with top-weight 94/0/0 and true-margin 84/4/6, coronal single-view acc/f1 0.744681/0.700000 but full fusion worsened, so discard and stop simple coronal aux weight sweeps.
c16a69e	0.925532	0.966818	0.919540	2.2	discard	formal	DFR-93-RESNEXT-DECISION-256X8-CORONAL-PAIR-ABNORMAL-AUX-SEED42-MAIN-STUDY: 设计思路=after DFR90-92 showed coronal positive evidence can be trained but gate remains hard axial, combine coronal abnormal aux with axial-coronal pair selector aux so coronal evidence and gate ranking receive aligned supervision; 预计改进效果=move top-weight away from DFR92 94/0/0 toward axial-majority plus small coronal top/near-top routing on true-margin-supported cases, potentially pushing learned full-fusion above matched equal-weight seed42; 实验实际结果=fresh main-study runs/optuna_main_resnext_decision_256x8_dfr93_coronal_pair_abnormal_aux completed seed42 weights 0.0025/0.005/0.01 with val_acc 0.925532/0.914894/0.914894 and best trial0 val_auc 0.966818 val_f1 0.919540; fusion telemetry mean weights 0.6414/0.1179/0.2407 with top-weight 72/0/22 and true-margin 84/4/6, but coronal and sagittal single-view F1 stayed 0.0, so pair aux moved gate but released the wrong sagittal competition; discard and next test forced axial-coronal active mask.
11e76ff	0.925532	0.975909	0.923077	2.2	discard	formal	DFR-94-RESNEXT-DECISION-256X8-FORCED-AXCOR-PAIR-AUX-SEED42-MAIN-STUDY: 设计思路=after DFR93 moved gate away from axial but released wrong sagittal top-weight, keep coronal pair aux and force active-view mask 1,1,0 so final fusion only compares axial and coronal; 预计改进效果=remove sagittal competition so coronal should receive top/near-top effective weight on coronal true-margin samples and learned full-fusion should exceed matched equal-weight seed42 if sagittal competition was the main blocker; 实验实际结果=fresh main-study runs/optuna_main_resnext_decision_256x8_dfr94_forced_axcor_pair_aux completed seed42 weights 0.001/0.0025/0.005 with val_acc 0.914894/0.925532/0.914894 and best trial1 val_auc 0.975909 val_f1 0.923077; active-mask telemetry mean effective weights 0.9993/0.0007/0.0000 with raw 0.7207/0.0004/0.2789, top-weight 94/0/0 and true-margin 65/27/2, while coronal F1 stayed 0.0, so removing sagittal competition did not release coronal; discard and next run clean DFR25 active-view mask controls without aux.
f7328d9	0.925532	0.978636	0.921348	2.2	discard	formal	DFR-95-RESNEXT-DECISION-256X8-ACTIVE-MASK-CONTROL-SEED42-MAIN-STUDY: 设计思路=after DFR94 showed coronal pair aux plus forced axial-coronal mask collapsed back to axial, remove all aux losses and test clean DFR25 forced two-view masks axial+coronal, axial+sagittal, and coronal+sagittal; 预计改进效果=if active masking itself is useful, at least one two-view mask should preserve DFR25 seed42 accuracy while reducing hard axial lock-in or revealing a safer non-coronal path; 实验实际结果=fresh main-study runs/optuna_main_resnext_decision_256x8_dfr95_active_mask_control completed seed42 masks 1,1,0 / 1,0,1 / 0,1,1 with val_acc 0.914894/0.925532/0.872340 and best axial+sagittal trial1 val_auc 0.978636 val_f1 0.921348; active-mask telemetry for best trial effective mean weights 0.9978/0.0000/0.0022, top-weight 94/0/0 and true-margin 85/4/5, while coronal+sagittal without axial fell to 0.872340, so active masks do not improve DFR25 and hard deleting views is not a useful next direction.
4cc1bc0	0.936170	0.978636	0.933333	0.0	discard	formal	DFR-96-RESNEXT-DECISION-256X8-GATE-TARGET-CALIBRATION-AUDIT-ANALYSIS: 设计思路=analysis-only audit of existing DFR25 seed42 plus DFR90-95 fusion_weight telemetry to calibrate a tiny non-axial gate target before adding another training repair; 预计改进效果=if a reliable target exists, top-weight should remain axial-majority while only a few DFR25-wrong validated coronal/sagittal samples migrate, avoiding broad averaging and giving learned full-fusion a route above matched equal-weight; 实验实际结果=no new checkpoint, DFR25 seed42 reference 0.936170/0.978636/0.933333 with mean weights 0.888561/0.079051/0.032389 and top-weight 94/0/0; audit recommended target axial 90/94 coronal 0/94 sagittal 4/94, validated sagittal promote 3, missed nonaxial need 1, fragile axial-protect 4, and all DFR90-95 comparators were net negative, so analysis is diagnostic discard and next should be sagittal-only FP/normal-safe low-coverage rescue.
2ac9151	0.925532	0.974091	0.921348	2.2	discard	formal	DFR-97-RESNEXT-DECISION-256X8-SAGITTAL-NORMAL-RESCUE-AUX-SEED42-MAIN-STUDY: 设计思路=after DFR96 audit showed only a tiny validated sagittal-normal rescue target, add a train-time sagittal normal rescue auxiliary that only lets an axial+sagittal pair CE update fusion weights when detached axial predicts abnormal and sagittal predicts normal, leaving inference-time learned decision fusion unchanged; 预计改进效果=global routing should remain strongly axial while moving only about 3-4 validated FP/normal rescue samples from axial top-weight toward sagittal top/near-top, with coronal not released, giving learned full-fusion a path above matched equal-weight seed42 without broad averaging; 实验实际结果=fresh main-study iter_0002_20260512_203844 completed seed42 weights 0.001/0.0025/0.005 with val_acc 0.925532/0.925532/0.914894 and best trial1 val_auc 0.974091 val_f1 0.921348; fusion telemetry mean weights axial/coronal/sagittal 0.7116/0.1860/0.1024 with top-weight 81/13/0 and true-margin 84/3/7, so the aux did not release sagittal and instead over-migrated coronal without exceeding matched equal-weight.
ed507f4	0.936170	0.974091	0.931818	2.2	discard	formal	DFR-98-RESNEXT-DECISION-256X8-SAGITTAL-NORMAL-RESCUE-GATE-SEED42-MAIN-STUDY: 设计思路=after DFR96 tiny target and DFR97 coronal side-effect, add default-closed eval-only sagittal logit residual gate that fires only when detached axial is abnormal, sagittal is normal, fused output is abnormal, and current top confidence is axial; 预计改进效果=top-weight should stay axial-majority but migrate only a few axial-FP/sagittal-normal rescue samples toward sagittal near-top/top, with coronal remaining near zero, giving learned full-fusion a chance to beat matched equal-weight by fixing false positives without averaging views; 实验实际结果=fresh main-study iter_0003_20260512_210836 completed seed42 residual limits 0.25/0.50/0.75 with val_acc 0.914894/0.936170/0.925532 and best trial1 val_auc 0.974091 val_f1 0.931818; fusion telemetry mean weights axial/coronal/sagittal 0.8045/0.1172/0.0783 with top-weight 91/3/0 and true-margin 83/3/8, so the gate matched DFR25 seed42 accuracy but lower AUC and still failed to release sagittal while allowing small coronal migration.
30b474a	0.936170	0.978636	0.933333	0.0	discard	formal	DFR-99-RESNEXT-DECISION-256X8-POST-TRAINING-CALIBRATION-AUDIT-ANALYSIS: 设计思路=after DFR98 failed to release sagittal, run analysis-only post-training confidence-logit calibration grid on DFR25 seed42 telemetry to test whether observable sagittal-normal triggers can cover the DFR96 tiny target while protecting fragile axial cases; 预计改进效果=if usable, top-weight should stay axial-majority but move about 3-4 validated sagittal-normal FP rescue samples to sagittal top/near-top, with mean axial still high and learned full-fusion beating matched equal-weight rather than averaging weights; 实验实际结果=14400 candidates, best by val_acc/val_auc is no-trigger equivalent DFR25 seed42 0.936170/0.978636/0.933333 with mean weights 0.888561/0.079051/0.032389 and top-weight 94/0/0; best target-coverage rule triggered 44 samples covering 3 validated targets but still yielded sagittal top 0 and top-weight 94/0/0, so current observable triggers cannot capture the DFR96 target.
2384467	0.925532	0.980909	0.923077	2.1	discard	formal	DFR-100-RESNEXT-DECISION-256X8-GATE-PAIRWISE-CONTRAST-AUX-SEED42-MAIN-STUDY: 设计思路=after DFR99 showed handwritten sagittal triggers cannot cover the tiny target, add train-time disagreement-gated pairwise contrast auxiliary over axial/coronal, axial/sagittal, and coronal/sagittal pairs; candidate pair logits use detached per-view logits weighted by learned pair-normalized raw fusion weights so gradients update gate routing but not view classifiers; 预计改进效果=all-agree axial-strong samples should remain axial while disagreement samples where non-axial evidence is better should gain coronal/sagittal near-top or top routing, moving DFR25 top-weight 94/0/0 toward axial-majority with a few validated non-axial routes and potentially pushing learned full-fusion above matched equal-weight; 实验实际结果=fresh main-study iter_0005_20260512_220517 completed seed42 aux weights 0.001/0.0025/0.005 with best trial2 weight 0.005 val_acc 0.925532 val_auc 0.980909 val_f1 0.923077; fusion telemetry mean weights axial/coronal/sagittal 0.7546/0.1687/0.0767 with top-weight 86/8/0 and top_true_margin 84/3/7, so the aux moved some mass/top-routing to coronal but still released no sagittal and only matched equal-weight below DFR25.
f300ae3	0.925532	0.975909	0.923077	2.1	discard	formal	DFR-101-RESNEXT-DECISION-256X8-AXIAL-SAGITTAL-RANK-AUX-SEED42-MAIN-STUDY: 设计思路=after DFR100 proved pairwise contrast aux can move gate but mostly to non-beneficial coronal, add a single axial-sagittal rank auxiliary that only fires when detached axial predicts abnormal and sagittal predicts normal; class 0 supervises sagittal reliability and class 1 preserves axial reliability, so coronal is excluded and view classifiers are detached. 预计改进效果=top-weight should remain axial-majority but migrate a tiny DFR96-style sagittal-normal rescue subset from DFR25 axial 94/0/0 toward about axial 90/94 sagittal 3-4/94, avoiding DFR100 coronal 8 top-weight drift and giving learned full-fusion a path above matched equal-weight seed42. 实验实际结果=fresh main-study iter_0006_20260512_224440 completed seed42 aux weights 0.0005/0.001/0.0025; best trial2 weight 0.0025 val_acc 0.925532 val_auc 0.975909 val_f1 0.923077, only tying matched equal-weight and below DFR25 seed42; fusion telemetry mean weights axial/coronal/sagittal 0.9096/0.0725/0.0179 with top-weight 94/0/0 and top_true_margin 83/2/9, so the rank aux re-collapsed to axial and failed to release sagittal routing.
3d7519d	0.925532	0.973636	0.921348	2.1	discard	formal	DFR-102-RESNEXT-DECISION-256X8-SAGITTAL-RELIABILITY-CALIBRATOR-SEED42-MAIN-STUDY: 设计思路=after DFR101 recollapsed to axial because pair-weight CE still depends on base gate scores, add a default-off learned sagittal-only confidence residual calibrator using detached per-view logits/current weights/context so it can learn a reliability correction without changing view classifiers or fixed averaging; 预计改进效果=keep axial majority but lift sagittal top/near-top on evidence-backed rescue cases, expected top-weight from DFR101 94/0/0 toward about 88-92 axial, 0-3 coronal, 2-6 sagittal, with mean sagittal rising only on valid samples, giving learned full-fusion a path above matched equal-weight seed42; 实验实际结果=fresh main-study iter_0007 completed residual limits 0.25/0.5/1.0 with val_acc 0.925532/0.914894/0.904255 and best trial0 val_auc 0.973636 val_f1 0.921348; fusion telemetry mean weights axial/coronal/sagittal 0.5577/0.2564/0.1858 with top-weight 88/6/0 and top_true_margin 67/20/7, so the calibrator released coronal/mean sagittal mass but still no sagittal top-routing and only tied matched equal-weight below DFR25 seed42.
20974d6	0.925532	0.953182	0.915663	2.1	discard	formal	DFR-103-RESNEXT-DECISION-256X8-SAGITTAL-CORONAL-COMPETITIVE-CALIBRATOR-SEED42-MAIN-STUDY: 设计思路=在 DFR-102 sagittal calibrator 基础上只加一个 sagittal-coronal competitive residual；当 calibrator 学到正向 sagittal boost 时，同步按比例压低 coronal reliability，避免 DFR-102 把 non-axial mass 释放给 coronal 而 sagittal 仍无法成为 top。预计改进效果=保持 axial 为多数 top-weight，但把 DFR-102 的 top_weight 88/6/0 迁移到约 88-92/0-2/2-4；mean sagittal 可小幅上升或保持，coronal top 应下降，若 DFR-102 的 sagittal mass 确实来自有效 rescue 样本，这种 sagittal-over-coronal 排序修复有机会把 learned full-fusion seed42 val_acc 推过 matched equal-weight 0.9255319148936170，而不是把权重平均化。实验实际结果=fresh main-study iter_0008 completed suppression 0.25/0.5/0.75 with val_acc 0.893617/0.914894/0.925532; best trial2 val_auc 0.953182 val_f1 0.915663 peak_vram≈2.14 GiB; fusion telemetry mean weights axial/coronal/sagittal 0.8843/0.1108/0.0049 with top-weight 88/6/0 and top_true_margin 66/25/3, so competitive suppression neither reduced coronal top-routing nor released sagittal and only tied matched equal-weight below DFR-25 seed42.
442e4a2	0.914894	0.987273	0.906977	2.1	discard	formal	DFR-104-RESNEXT-DECISION-256X8-GATE-LABEL-EVIDENCE-RANK-AUX-SEED42-MAIN-STUDY: 设计思路=from DFR25 add a train-time gate label-evidence rank auxiliary: build a detached per-view log-prob mixture weighted by raw learned fusion weights and supervise it with labels, so gradients update gate ranking toward the view(s) whose own evidence supports the true class without changing per-view classifier logits or inference fusion semantics. 预计改进效果=relative to DFR103/DFR25 axial-heavy routing, top-weight should remain axial-majority but move a small evidence-backed subset from axial 94/0/0 toward coronal/sagittal when their detached true-label probability is higher; mean axial should stay high rather than average out, and such label-conditioned right-view routing could push learned full-fusion seed42 above matched equal-weight 0.9255319148936170. 实验实际结果=fresh main-study iter_0009 completed aux weights 0.0005/0.001/0.0025 with all val_acc 0.914894 and best trial0 val_auc 0.987273 val_f1 0.906977 peak_vram≈2.15 GiB; fusion telemetry mean weights axial/coronal/sagittal 0.8890/0.0400/0.0710 with top-weight 94/0/0 and top_true_margin 86/4/4, so the label-evidence CE reinforced axial top-routing, did not release coronal/sagittal evidence-backed samples, and fell below matched equal-weight/DFR25.
4b43d9d	0.936170	0.972727	0.933333	2.1	discard	formal	DFR-105-RESNEXT-DECISION-256X8-TARGETED-NONAXIAL-EVIDENCE-RANK-AUX-SEED42-MAIN-STUDY: 设计思路=after DFR104 global label-evidence CE reinforced axial, restrict the train-time gate rank auxiliary to labels/classes where detached coronal or sagittal true-class log-prob beats axial by a margin; gradients update pair-normalized gate weights only, preserving DFR25 inference fusion and avoiding blanket averaging. 预计改进效果=top-weight should remain axial-majority but a few evidence-backed samples should migrate from DFR25 94/0/0 toward roughly 88-92 axial and several coronal/sagittal top or near-top routes; because the aux fires only when non-axial evidence outranks axial, it could push learned full-fusion over matched equal-weight without spreading mass uniformly. 实验实际结果=fresh main-study iter_0010 completed gap 0.02/0.05/0.10 with best trial0 gap 0.02 val_acc 0.936170 val_auc 0.972727 val_f1 0.933333 peak_vram≈2.15 GiB; fusion telemetry mean weights axial/coronal/sagittal 0.8168/0.1262/0.0569 with top-weight 94/0/0 and top_true_margin 80/2/12, so accuracy only tied DFR25 seed42 with lower AUC and the targeted aux still failed to release non-axial top routing.
35375bc	0.936170	0.978636	0.933333	0.0	discard	formal	DFR-106-RESNEXT-DECISION-256X8-TARGETED-AUX-TRIGGER-AUDIT-ANALYSIS: 设计思路=analysis-only audit after DFR105, replay targeted non-axial evidence-rank aux triggers on DFR25 seed42 and DFR105 best telemetry to validate whether supervision actually covers DFR25 errors/non-axial true-margin samples before adding another mechanism; 预计改进效果=expected target audit should identify a tiny coronal/sagittal candidate set rather than broad averaging, ideally axial remains 94/0/0 in reference telemetry while target distribution points to a few confirmed non-axial samples that could be promoted in a later selector target and push learned fusion above matched equal-weight; 实验实际结果=no new checkpoint; DFR25 seed42 reference val_acc/auc/f1 0.936170/0.978636/0.933333 with mean weights 0.8886/0.0791/0.0324 and top-weight 94/0/0; DFR105 best matched accuracy but lower AUC with mean weights 0.8168/0.1262/0.0569 and top-weight 94/0/0; audit gap 0.02/0.05/0.10 on DFR25 source all trigger the same 8 samples target coronal/sagittal 2/6, cover 6/6 DFR25 errors and 8/9 non-axial true-margin samples with helpful_if_promoted 4 harmful 0, but DFR105 target top/near-top after training remains 0/8, so failure is pair-weight training strength/form rather than trigger contamination.
b583d16	0.936170	0.975909	0.930233	2.1	discard	formal	DFR-107-RESNEXT-DECISION-256X8-CONFIRMED-TARGET-RANK-MARGIN-AUX-SEED42-MAIN-STUDY: 设计思路=after DFR106 confirmed the targeted-aux trigger is clean but too weak, replace pair-normalized soft CE with a confirmed-target rank-margin gate aux that only fires when detached non-axial evidence beats axial, preserving DFR25 geometry/scalars and varying only rank margin 0.10/0.25/0.50; 预计改进效果=target samples should move from DFR105 target top/near-top 0/8 toward a few coronal/sagittal top or near-top routes while global top-weight remains axial-majority around 88-92/94, letting learned full-fusion beat matched equal-weight through right-view promotion rather than averaging; 实验实际结果=fresh main-study iter_0002_20260513_023419 completed; best trial1 margin 0.25 val_acc/auc/f1=0.936170/0.975909/0.930233, tying DFR25 seed42 accuracy but below DFR25 AUC; fusion telemetry mean weights axial/coronal/sagittal=0.8185/0.1132/0.0683, top-weight count/rate=94(1.0000)/0(0.0000)/0(0.0000), top_true_margin=84/6/4, so it raised non-axial mean mass but did not move any top routing and remains discard.
6a4939b	0.936170	0.978636	0.933333	0.0	discard	formal	DFR-108-RESNEXT-DECISION-256X8-DFR107-AUX-ENCODING-AUDIT-ANALYSIS: 设计思路=analysis-only audit after DFR107; replay confirmed-target rank-margin target and compute the effective train.py binary patient-label CE gradient direction for target-vs-axial gate log-weights, without launching new training. 预计改进效果=reference telemetry should stay DFR25/DFR107 top-weight 94/0/0; if CE encoding or non-target-only pressure is the blocker, next mechanism can be label-invariant and scoped to confirmed DFR25 error/non-axial true-margin samples, aiming for axial-majority around 88-92 top with only a few confirmed sagittal/coronal top or near-top routes to beat matched equal-weight. 实验实际结果=no new checkpoint; DFR25 seed42 reference val_acc/auc/f1 0.936170/0.978636/0.933333 mean weights 0.8886/0.0791/0.0324 top-weight 94/0/0; DFR107 best 0.936170/0.975909/0.930233 mean weights 0.8185/0.1132/0.0683 top-weight 94/0/0; DFR25-source audit found 6 true targets all label0 sagittal, covering 4/6 DFR25 errors and 6/9 non-axial true-margin with helpful/harmful 4/0, but target top/near-top after DFR107 0/6 and 44 non-target-only samples produced axial-reinforcing CE pressure, so failure is class-coded aux dilution rather than target pollution.
34946a1	0.925532	0.978636	0.921348	2.1	discard	formal	DFR-109-RESNEXT-DECISION-256X8-FP-RISK-AXIAL-SAGITTAL-RANK-AUX-SEED42-MAIN-STUDY: 设计思路=after DFR108 showed class-coded non-target pressure, add a narrow FP-risk axial-sagittal rank auxiliary that detaches inactive samples and fires only when fused/axial abnormal risk plus sagittal-normal evidence suggests a normal rescue case; positive labels preserve axial over sagittal while label0 promotes sagittal, avoiding the broad non-target-only axial reinforcement seen in DFR107. 预计改进效果=top-weight should stay axial-majority but release only a tiny sagittal-normal target subset from DFR25 94/0/0 toward about 90-92 axial and 2-4 sagittal top or near-top routes, with coronal suppressed, giving learned fusion a chance to exceed matched equal-weight without broad averaging. 实验实际结果=fresh study completed 3 seed42 candidates; best trial2 val_acc/auc/f1=0.925532/0.978636/0.921348, tying matched equal-weight seed42 but below DFR25 seed42; fusion telemetry mean weights axial/coronal/sagittal=0.8771/0.0668/0.0561 with top-weight 94/0/0 and top_true_margin 87/5/2, while coronal and sagittal per-view sensitivity were 0, so the target did not release sagittal routing and weakened non-axial classifiers.
53cb56e	0.936170	0.978636	0.933333	0.0	discard	formal	DFR-110-RESNEXT-DECISION-256X8-DFR109-TARGET-DRIFT-AUDIT-ANALYSIS: 设计思路=analysis-only audit after DFR109; compare DFR25, DFR107, and DFR109 fusion telemetry on the six DFR108 confirmed true targets and the non-target-only positive samples, replaying the DFR109 FP-risk trigger to decide whether the failure came from threshold coverage or training-side evidence drift. 预计改进效果=if DFR109 was close, the audit should show high true-target trigger overlap, low positive-non-target overlap, and target samples gaining sagittal near-top/top without per-view collapse; this would justify one narrower train-time mechanism rather than broad threshold sweeps. 实验实际结果=no new checkpoint; DFR109 trigger on DFR25 covered only 3/6 true targets and also hit 2 positive non-target-only samples; true-target transitions vs DFR25 were fixed 1, broken 1, stayed wrong 3, net 0; DFR109 changed the true-target top_true_margin profile from 6 sagittal to 5 coronal/1 axial and kept top_weight 94/0/0, confirming threshold plus training-side weak-view drift rather than a near-miss sagittal release.
