commit	val_acc	val_auc	val_f1	memory_gb	status	config	description
99102b2	0.959707	0.982439	0.955819	0.0	keep	formal	DFR-131-RESNEXT-DECISION-256X8-CLEAN-SAMPLING-VARIABLE-AUDIT-ANALYSIS: 设计思路=after DFR130 closed train-time axial aux, extend DFR126 from 7 remaining clean-error patients to the full combined-clean validation set and compare baseline 8-slice/trim2 coverage against runtime sampling grids without data edits or test metrics. 预计改进效果=if remaining weak-positive FN cases are sampling-limited, they should show higher coronal coverage flag rates than clean-correct cases and a single global num_slices/trim candidate should resolve those flags without creating clean-correct collateral. 实验实际结果=91 clean patients / 273 seed-cases; remaining errors stay 7 patients / 11 cases. Positive remaining patients had coronal low_hu300_peak_coverage 2/2 and misses_std_top10 1/2, higher than positive clean-correct 15/39 and 7/39. Best expressible candidate n32_trim2 resolved positive-remaining coronal low_hu300 2/2 and std top10 1/1, resolved remaining-error coronal flags 3 low_hu300 / 1 hu300_top10 / 3 std_top10, and created no clean-correct coronal flags. Keep as analysis-positive; next run DFR132 global num_slices_per_view=32, trim_edge_slices=2 formal probe.
5f791cb	0.882979	0.951818	0.881720	6.6	discard	formal	DFR-132-RESNEXT-DECISION-256X32-SAMPLING-FORMAL-SEED42: 设计思路=after DFR131 ranked n32_trim2 as the strongest expressible sampling candidate, run a single-variable DFR25-anchor formal probe changing only data.num_slices_per_view from 8 to 32 while keeping trim_edge_slices=2, geometry, scalars, runtime env and decision-fusion semantics fixed. 预计改进效果=more sampled slices should improve coronal positive evidence for DFR126 weak-positive FN patients without creating clean-correct collateral; routing could remain axial-majority but mean coronal weight and/or coronal per-view sensitivity should not collapse. 实验实际结果=Slurm job 486935 completed with val_acc/auc/f1 0.882979/0.951818/0.881720 and peak_vram 6.6GB, far below DFR25 seed42 0.936170/0.978636/0.933333 and DFR116 seed42 0.957447/0.983182/0.954545. Fusion telemetry worsened axial lock-in: mean weights axial/coronal/sagittal 0.968695/0.012623/0.018682, top-weight 94/0/0, coronal per-view F1 0.0. Versus DFR25 fixed CTyin122/CTyin21 but broke 7 cases; versus DFR116 fixed 1 and broke 8, including losing CTyin95. Discard; n32 global sampling does not rescue coronal evidence and should not be promoted.
46151cc	0.893617	0.963636	0.891304	5.1	discard	formal	DFR-133-RESNEXT-DECISION-256X24-SAMPLING-FORMAL-SEED42: 设计思路=after DFR132 showed n32_trim2 was too aggressive despite the DFR131 static audit, test DFR131's second-ranked expressible candidate n24_trim2 as the same single-variable DFR25-anchor formal probe. 预计改进效果=n24 may retain more pretrained slice-stack stability than n32 while still improving clean remaining coronal coverage; expected behavior is no coronal/sagittal weight collapse and possible rescue of weak-positive FN without expanding strong axial FP. 实验实际结果=Slurm job 486936 completed with val_acc/auc/f1 0.893617/0.963636/0.891304 and peak_vram 5.1GB, better than DFR132 but still far below DFR25 seed42 0.936170/0.978636/0.933333 and DFR116 seed42 0.957447/0.983182/0.954545. Mean weights were 0.797502/0.096262/0.106236, but top-weight stayed 94/0/0 and coronal/sagittal per-view F1 both collapsed to 0.0. Versus DFR25 fixed CTyin122/CTyin21 but broke 6 cases; versus DFR116 fixed 1 and broke 7, including losing CTyin95. Discard and audit sampling-size evidence drift before any further global slice-count training.
f007223	0.893617	0.963636	0.891304	0.0	keep	formal	DFR-134-RESNEXT-DECISION-SAMPLING-SIZE-EVIDENCE-DRIFT-AUDIT-ANALYSIS: 设计思路=after DFR132/133 both failed, run a read-only validation telemetry audit comparing DFR25 seed42, DFR116 seed42, DFR132 n32 and DFR133 n24 with DFR131 static coverage flags to determine whether global slice-count training failed because of gate routing, classifier evidence drift, or static coverage being non-predictive. 预计改进效果=if n24/n32 merely had gate issues, coronal positive abnormal/true margins should improve while top-weight remains axial; if classifier evidence drifts down, further global slice-count formal runs should stop and the next step should isolate frozen-checkpoint eval-side sampling. 实验实际结果=report autoresearch_logs/dfr134_sampling_size_evidence_drift.json shows n24 better than n32 but both discard; non-axial F1 for n24/n32 is coronal=0.0 and sagittal=0.0, top-weight remains 94/0/0. Positive remaining coronal drift vs DFR25 is negative for both candidates: n32 abnormal -0.164075 / true_margin -0.707789 / weight -0.052581; n24 abnormal -0.177025 / true_margin -0.769615 / weight +0.040474. Keep as analysis-positive branch closure: close global slice-count formal family and run DFR135 frozen-checkpoint sampling replay.
3e1c262	0.882979	0.961818	0.881720	0.0	discard	formal	DFR-135-RESNEXT-DECISION-FROZEN-DFR25-SAMPLING-REPLAY-ANALYSIS: 设计思路=after DFR134 showed trained n24/n32 reduce coronal evidence, replay the DFR25 seed42 checkpoint without training using n24 and n32 validation dataloaders to separate training-induced drift from eval-side sampling mismatch. 预计改进效果=if static coverage is useful and training large-S caused the problem, frozen replay should improve positive remaining coronal evidence or at least preserve DFR25 accuracy while changing sampling; if frozen replay also degrades, global slice count is not a viable eval-side repair. 实验实际结果=Slurm job 486937 generated frozen telemetry for n24 and n32. Both replay variants dropped to val_acc/f1=0.882979/0.881720; best replay AUC was n32=0.961818, below DFR25 0.978636. n24 frozen fixed CTyin21 but broke six DFR25-correct cases; n32 frozen fixed none and broke five. Coronal F1 stayed nonzero but below baseline: DFR25 0.588235 vs n24 0.483871 vs n32 0.459016; positive remaining coronal evidence did not rescue CTyang3. Discard direct frozen replay; only a label-free ensemble/frontier audit remains worth checking.
c5c9b11	0.946809	0.980909	0.943820	0.0	keep	formal	DFR-136-RESNEXT-DECISION-SAMPLING-REPLAY-FRONTIER-AUDIT-ANALYSIS: 设计思路=after DFR135 showed direct frozen n24/n32 replay degrades, scan label-free probability blends and selectors over DFR25 plus frozen n24/n32 validation telemetry without training, test metrics, or data edits. 预计改进效果=if alternate sampling has usable eval-side signal, a candidate should improve DFR25 with broken_count=0 and ideally protect DFR116 combo-correct samples; otherwise close sampling replay family. 实验实际结果=2048 candidates scanned; 263 improved DFR25 with no DFR25 break, but every candidate broke DFR116 correctness (dfr116_safe_count=0). Best candidate lower_n24_base0.80_alt0.550_d0.30 triggers only CTyin21, giving 0.946809/0.980909/0.943820 vs DFR25 fixed=1/broken=0, but it loses DFR116's CTyin95 repair and stays below DFR116 seed42 0.957447/0.983182/0.954545. Keep only as analysis-positive branch closure; stop sampling-count/replay family.
70002d9	0.959707	0.982439	0.955819	0.0	keep	formal	DFR-137-RESNEXT-DECISION-REMAINING-ERROR-DECISION-AUDIT-ANALYSIS: 设计思路=after closing posthoc expansion, axial-risk gate, and sampling replay families, consolidate DFR116 clean remaining false cases into a stop/go decision table using existing validation reports only. 预计改进效果=if any model-side path remains, at least one clean remaining patient should have an expressible candidate not already closed by DFR125/127/136; otherwise next work should be data/annotation review packet rather than training. 实验实际结果=combined-clean DFR116 metrics remain 0.959707/0.982439/0.955819. Seven clean remaining patients / 11 cases split into duplicate_positive_annotation_review=1, positive_no_view_evidence_annotation_review=1, negative_strong_axial_fp_label_or_view_classifier_review=5. model_side_supported_patient_count=0. Closed families: posthoc threshold expansion, label-free axial FP gate, global slice-count training, frozen sampling replay, sampling replay blend/selector. Keep as decision audit; next DFR138 should produce compact review packet for the 7 clean remaining patients, not start another training run.
f19473d	0.959707	0.982439	0.955819	0.0	keep	formal	DFR-138-RESNEXT-DECISION-CLEAN-REMAINING-REVIEW-PACKET-ANALYSIS: 设计思路=after DFR137 found no immediate model-side experiment, generate a compact read-only JSON/Markdown packet for the seven DFR116 combined-clean remaining patients, using metadata, hashes, duplicate groups, sampling flags, and DFR25/DFR116 validation telemetry only. 预计改进效果=the packet should make the remaining evidence/label review actionable and prevent further training until a model-expressible target is identified. 实验实际结果=created autoresearch_logs/dfr138_clean_remaining_review_packet.json and .md with 7 patients / 11 cases. Buckets remain duplicate_positive_annotation_review=1, positive_no_view_evidence_annotation_review=1, negative_strong_axial_fp_label_or_view_classifier_review=5; model_side_supported_patient_count=0 and immediate_training_recommended=false. Keep as review asset; next DFR139 should derive only data/annotation review questions or a narrow model target from this packet, not run training by default.
50800a3	0.959707	0.982439	0.955819	0.0	keep	formal	DFR-139-RESNEXT-DECISION-TRAINING-GATE-FROM-REVIEW-PACKET-ANALYSIS: 设计思路=convert the DFR138 review packet into an explicit training go/no-go gate without training, test metrics, or data edits. 预计改进效果=if any reviewed patient already identifies a model-expressible target, training_go may be true; otherwise the report should block training and list required review answers. 实验实际结果=training_go=false, training_allowed_now_count=0 for 7 patients / 11 cases. Required review answers cover duplicate positive CTyang3, no-view-evidence positive CTyang54, and five strong axial FP negatives CTyin113/95/109/122/21. Current best branch remains DFR116 strict posthoc combo. Keep as governance report; no new training should launch until review answers identify a model-expressible target.
35da418	0.959707	0.982439	0.955819	0.0	keep	formal	DFR-140-RESNEXT-DECISION-AUTORESEARCH-HANDOFF-EXPORT-ANALYSIS: 设计思路=package the current DFR116 strict combo branch, DFR138 review packet, and DFR139 training gate into one compact handoff markdown without training, test metrics, or data edits. 预计改进效果=the handoff should preserve the current best posthoc branch metrics and make the remaining review questions explicit so future work does not launch unsupported training. 实验实际结果=created autoresearch_logs/dfr140_handoff.md; DFR25 reference mean 0.939716/0.967727/0.935893, DFR116 combo mean 0.950355/0.971515/0.946965, combined-clean DFR116 0.959707/0.982439/0.955819, fixed cases 123:CTyang147 and 42:CTyin21/95, broken none. training_go remains false and all 7 remaining patients / 11 cases require review answers before new training.
d7dcb12	0.959707	0.982439	0.955819	0.0	keep	formal	DFR-141-RESNEXT-DECISION-REPRODUCIBILITY-ARCHIVE-MANIFEST-ANALYSIS: 设计思路=build a read-only reproducibility/archive manifest for the retained DFR116 branch and DFR138/139/140 governance assets, checking presence and hashes for scripts, configs, reports, checkpoints, and telemetry without training or data edits. 预计改进效果=the manifest should pass only if all critical DFR116 reproduction and review-gate assets are present, making it safe to pause model-side work until review answers arrive. 实验实际结果=created autoresearch_logs/dfr141_repro_manifest.json and .md; manifest status pass, 24 assets present, missing_asset_count=0, all DFR119 validation checks pass, DFR116 combo mean 0.950355/0.971515/0.946965, combined-clean diagnostic 0.959707/0.982439/0.955819, training_go=false for 7 patients / 11 cases.
eef1939	0.959707	0.982439	0.955819	0.0	keep	formal	DFR-142-RESNEXT-DECISION-HUMAN-REVIEW-ANSWER-TEMPLATE-ANALYSIS: 设计思路=export a fillable human review answer template from DFR141/DFR139 so remaining duplicate/annotation/strong-axial-FP questions can be answered in a structured way before any new training. 预计改进效果=the template should preserve training_go=false while making future review answers machine-readable enough to map into a narrow model-expressible hypothesis only when justified. 实验实际结果=created autoresearch_logs/dfr142_review_answer_template.json and .md with 7 entries / 11 cases, explicit allowed answer values, go rules, and action hints; training_go=false and training_allowed_now_count=0 remain unchanged, current best branch remains DFR116 strict combo.
fe42d90	0.939716	0.975909	0.934415	2.2	keep	formal	PAPER-FEATURE-FUSION-GATED-HEAD-3SEED-FORMAL: 设计思路=validate the best ResNeXt 256x8 feature-fusion gated-head template for paper completeness using matched seeds 42/123/456, same data geometry, freeze3, lr 1e-4, wd 1e-4, dropout 0.25, and 15 epochs. 预计改进效果=per-view recalibration + light cross-view mixer + GLU fused-token head should beat a minimal concat-MLP feature-fusion baseline under the same budget. 实验实际结果=Slurm job 516499 on clean node09 5-GPU allocation completed 6/6 runs; gated-head seeds 42/123/456 achieved 0.946809/0.979091/0.941176, 0.946809/0.978636/0.942529, 0.925532/0.970000/0.919540; 3-seed mean 0.939716/0.975909/0.934415, peak_vram max 2.17GB. Keep as paper feature-fusion best formal evidence.
fe42d90	0.914894	0.972121	0.906842	2.1	discard	formal	PAPER-FEATURE-FUSION-MINIMAL-BASELINE-3SEED-FORMAL: 设计思路=run the matched feature-fusion baseline with only concatenated ResNeXt view features and a 2-layer MLP, removing recalibration, cross-view mixer, prenorm, and GLU head. 预计改进效果=baseline quantifies whether the gated-head improvement is more than the backbone/training budget alone. 实验实际结果=same Slurm job 516499, seeds 42/123/456 all reached val_acc 0.914894 with AUC/F1 0.976364/0.911111, 0.970909/0.902439, 0.969091/0.906977; 3-seed mean 0.914894/0.972121/0.906842, peak_vram max 2.15GB. Discard as inferior model, retain as required paper control.
c709f7c	0.929078	0.962879	0.921827	2.2	discard	formal	PAPER-FEATURE-FUSION-ABLATION-NO-RECALIBRATION-3SEED-FORMAL: 设计思路=from the full gated-head anchor, remove only per-view feature recalibration while keeping cross-view mixer, prenorm, GLU head, geometry and scalars fixed. 预计改进效果=if recalibration contributes independent view-feature conditioning, removing it should reduce 3-seed mean below the full gated-head while staying above the minimal concat baseline. 实验实际结果=Slurm job 516767 on clean node09 5-GPU allocation completed 9/9 ablations; no-recal seeds 42/123/456 achieved 0.946809/0.975000/0.945055, 0.925532/0.966364/0.915663, 0.914894/0.947273/0.904762; 3-seed mean 0.929078/0.962879/0.921827, peak_vram max 2.16GB. Discard as candidate because it is below full gated-head by -0.010638 acc; retain as paper module ablation showing positive recalibration contribution.
c709f7c	0.921986	0.965758	0.910765	2.2	discard	formal	PAPER-FEATURE-FUSION-ABLATION-NO-XVIEW-MIXER-3SEED-FORMAL: 设计思路=from the full gated-head anchor, remove only the light CrossViewAttention mixer while keeping recalibration, prenorm, GLU head, geometry and scalars fixed. 预计改进效果=if cross-view token interaction contributes beyond independent view features, removing it should lower val_acc/F1 versus full gated-head. 实验实际结果=same Slurm job 516767; no-xview seeds 42/123/456 achieved 0.925532/0.961818/0.917647, 0.904255/0.967727/0.886076, 0.936170/0.967727/0.928571; 3-seed mean 0.921986/0.965758/0.910765, peak_vram max 2.16GB. Discard as candidate because it is below full gated-head by -0.017730 acc; retain as paper module ablation showing cross-view mixer contribution.
c709f7c	0.911348	0.974394	0.906366	2.2	discard	formal	PAPER-FEATURE-FUSION-ABLATION-NO-GLU-HEAD-3SEED-FORMAL: 设计思路=from the full gated-head anchor, replace only the LayerNorm/GLU gated fusion head with a matched plain ReLU MLP while keeping recalibration, xview mixer, prenorm, geometry and scalars fixed. 预计改进效果=if multiplicative fused-token gating is the main head-level gain, removing GLU should cause the largest accuracy/F1 drop among module ablations. 实验实际结果=same Slurm job 516767; no-GLU seeds 42/123/456 achieved 0.914894/0.961364/0.904762, 0.904255/0.977727/0.903226, 0.914894/0.984091/0.911111; 3-seed mean 0.911348/0.974394/0.906366, peak_vram max 2.16GB. Discard as candidate; it is below full gated-head by -0.028369 acc and roughly falls back to minimal-baseline accuracy/F1, supporting GLU head as the strongest module contribution.
1636769	0.000000	0.000000	0.000000	0.0	crash	formal	FF-ATTNPOOL-S8-3SEED-FORMAL: 设计思路=turn on learnable slice AttentionPooling in the current ResNeXt feature-fusion gated-head anchor and set num_slices_per_view=8, keeping trim2/freeze3/lr/wd/dropout/clip fixed. 预计改进效果=attention pooling should focus each view token on informative slices; larger slice counts may expose sparse lesion evidence if the extra context does not add noise. 实验实际结果=only 4/3 seeds completed; seed results: s42=0.893617/0.948182/0.886364, s123=0.904255/0.970455/0.886076, s123=0.904255/0.970455/0.886076, s456=0.882979/0.963182/0.857143.
1636769	0.000000	0.000000	0.000000	0.0	crash	formal	FF-ATTNPOOL-S12-3SEED-FORMAL: 设计思路=turn on learnable slice AttentionPooling in the current ResNeXt feature-fusion gated-head anchor and set num_slices_per_view=12, keeping trim2/freeze3/lr/wd/dropout/clip fixed. 预计改进效果=attention pooling should focus each view token on informative slices; larger slice counts may expose sparse lesion evidence if the extra context does not add noise. 实验实际结果=only 5/3 seeds completed; seed results: s42=0.914894/0.953636/0.902439, s42=0.914894/0.953636/0.902439, s123=0.893617/0.953182/0.871795, s456=0.914894/0.932727/0.906977, s456=0.914894/0.932727/0.906977.
1636769	0.904255	0.963030	0.895339	3.8	discard	formal	FF-ATTNPOOL-S16-3SEED-FORMAL: 设计思路=turn on learnable slice AttentionPooling in the current ResNeXt feature-fusion gated-head anchor and set num_slices_per_view=16, keeping trim2/freeze3/lr/wd/dropout/clip fixed. 预计改进效果=attention pooling should focus each view token on informative slices; larger slice counts may expose sparse lesion evidence if the extra context does not add noise. 实验实际结果=seed results: s42=0.904255/0.969091/0.898876, s123=0.893617/0.964545/0.878049, s456=0.914894/0.955455/0.909091; 3-seed mean=0.904255/0.963030/0.895339.
1636769	0.000000	0.000000	0.000000	0.0	crash	formal	FF-ATTNPOOL-S20-3SEED-FORMAL: 设计思路=turn on learnable slice AttentionPooling in the current ResNeXt feature-fusion gated-head anchor and set num_slices_per_view=20, keeping trim2/freeze3/lr/wd/dropout/clip fixed. 预计改进效果=attention pooling should focus each view token on informative slices; larger slice counts may expose sparse lesion evidence if the extra context does not add noise. 实验实际结果=only 5/3 seeds completed; seed results: s42=0.893617/0.950455/0.886364, s123=0.904255/0.957727/0.888889, s456=0.893617/0.944545/0.886364, s456=0.893617/0.944545/0.886364, s456=0.893617/0.944545/0.886364.
1636769	0.893617	0.960606	0.876527	2.2	discard	formal	FF-ATTNPOOL-S8-3SEED-FORMAL-CORRECTION: 设计思路=deduplicate resume-created completed trials by unique seed for the AttentionPooling slice-count campaign. 预计改进效果=ledger should reflect the intended 3-seed mean instead of treating repeated resume trials as crash/incomplete. 实验实际结果=unique seeds 42/123/456 completed; corrected 3-seed mean=0.893617/0.960606/0.876527, still below gated-head anchor 0.939716/0.975909/0.934415.
1636769	0.907801	0.946515	0.893737	3.0	discard	formal	FF-ATTNPOOL-S12-3SEED-FORMAL-CORRECTION: 设计思路=deduplicate resume-created completed trials by unique seed for the AttentionPooling slice-count campaign. 预计改进效果=ledger should reflect the intended 3-seed mean instead of treating repeated resume trials as crash/incomplete. 实验实际结果=unique seeds 42/123/456 completed; corrected 3-seed mean=0.907801/0.946515/0.893737, best corrected AttentionPooling group but still below gated-head anchor 0.939716/0.975909/0.934415.
1636769	0.897163	0.950909	0.887205	4.5	discard	formal	FF-ATTNPOOL-S20-3SEED-FORMAL-CORRECTION: 设计思路=deduplicate resume-created completed trials by unique seed for the AttentionPooling slice-count campaign. 预计改进效果=ledger should reflect the intended 3-seed mean instead of treating repeated resume trials as crash/incomplete. 实验实际结果=unique seeds 42/123/456 completed; corrected 3-seed mean=0.897163/0.950909/0.887205, still below gated-head anchor 0.939716/0.975909/0.934415.
2749343	0.907801	0.958788	0.897379	2.2	discard	formal	FF-STRUCT-01-GLU-HIDDEN384-3SEED-FORMAL: 设计思路=from the feature-fusion gated-head anchor, increase only the GLU fusion-head hidden width from 256 to 384 while keeping ResNeXt 256x8, mean pooling, trim2, recalibration, light CrossViewAttention, freeze3, lr/wd/dropout/clip, and seeds 42/123/456 fixed. 预计改进效果=if fused-token GLU capacity limits the anchor, wider hidden width should improve cross-view feature composition; otherwise it may add variance without useful signal. 实验实际结果=Slurm job 518423 on clean V100q/node21 completed this group; seeds 42/123/456 achieved 0.893617/0.970000/0.880952, 0.893617/0.940909/0.880952, 0.936170/0.965455/0.930233; 3-seed mean=0.907801/0.958788/0.897379, peak_vram max 2.17GB, below gated-head anchor 0.939716/0.975909/0.934415.
