commit	val_acc	val_auc	val_f1	memory_gb	status	config	description
f1e3508	0.840426	0.887273	0.810127	4.7	discard	formal	CMP-DECISION-EQUAL-RESNEXT-LEARNED-512X16-E20-S42: learned decision fusion on canonical resnext / seed42 lost to fixed equal-weight on both val_acc and val_auc in the matched 512x16 20-epoch control
f1e3508	0.882979	0.936364	0.867470	4.6	keep	formal	CMP-DECISION-EQUAL-RESNEXT-EQUAL-512X16-E20-S42: fixed equal-weight decision fusion on canonical resnext / seed42 beat learned weighting on both val_acc and val_auc in the matched 512x16 20-epoch control
3b826ad	0.851064	0.910909	0.844444	4.7	keep	formal	CMP-DECISION-EQUAL-RESNEXT-LEARNED-512X16-E20-S123: learned decision fusion beat fixed equal-weight on canonical resnext / seed123 in the matched 512x16 20-epoch control
3b826ad	0.840426	0.866364	0.810127	4.6	discard	formal	CMP-DECISION-EQUAL-RESNEXT-EQUAL-512X16-E20-S123: fixed equal-weight lost to learned decision fusion on canonical resnext / seed123 in the matched 512x16 20-epoch control
3b826ad	0.851064	0.920909	0.825000	4.7	keep	formal	CMP-DECISION-EQUAL-RESNEXT-LEARNED-512X16-E20-S456: learned decision fusion beat fixed equal-weight on canonical resnext / seed456 in the matched 512x16 20-epoch control
3b826ad	0.840426	0.889091	0.805195	4.6	discard	formal	CMP-DECISION-EQUAL-RESNEXT-EQUAL-512X16-E20-S456: fixed equal-weight lost to learned decision fusion on canonical resnext / seed456 in the matched 512x16 20-epoch control
paperrepro-R1	0.563829787234043	0.795000000000000	0.666666666666667	0.3	discard	proxy	R1 3D U-Net top-k dense anomaly aggregation
paperrepro-R4	0.744680851063830	0.823181818181818	0.657142857142857	0.3	discard	proxy	R4 3D dense vote / majority aggregation
paperrepro-D4	0.851063829787234	0.930909090909091	0.815789473684211	3.4	keep	proxy	D4 2.5D and 3D ensemble
aaa417a	0.840426	0.886364	0.823529	4.7	discard	formal	CMP-FUSION-PATH-RESNEXT-LEARNED-512X16-E20-S42: current learned VRG path tied minimal baseline on val_acc but lost on val_auc in the matched resnext fusion-path ablation
aaa417a	0.840426	0.921818	0.819277	4.6	keep	formal	CMP-FUSION-PATH-RESNEXT-MINIMAL-512X16-E20-S42: minimal learned decision baseline matched current learned VRG path on val_acc and beat it on val_auc in the matched resnext fusion-path ablation
4bae7a0	0.000000	0.000000	0.000000	0.0	crash	formal	CMP-DECISION-EQUAL-RESNEXT-ATTNPOOL-LEARNED-512X16-E20-S42: learned decision fusion with AttentionPooling on canonical resnext / seed42 in the matched 512x16 20-epoch control
4bae7a0	0.000000	0.000000	0.000000	0.0	crash	formal	CMP-DECISION-EQUAL-RESNEXT-ATTNPOOL-EQUAL-512X16-E20-S42: fixed equal-weight decision fusion with AttentionPooling on canonical resnext / seed42 in the matched 512x16 20-epoch control
4bae7a0	0.000000	0.000000	0.000000	0.0	crash	formal	CMP-DECISION-EQUAL-RESNEXT-ATTNPOOL-LEARNED-512X16-E20-S123: learned decision fusion with AttentionPooling on canonical resnext / seed123 in the matched 512x16 20-epoch control
4bae7a0	0.000000	0.000000	0.000000	0.0	crash	formal	CMP-DECISION-EQUAL-RESNEXT-ATTNPOOL-EQUAL-512X16-E20-S123: fixed equal-weight decision fusion with AttentionPooling on canonical resnext / seed123 in the matched 512x16 20-epoch control
4bae7a0	0.000000	0.000000	0.000000	0.0	crash	formal	CMP-DECISION-EQUAL-RESNEXT-ATTNPOOL-LEARNED-512X16-E20-S456: learned decision fusion with AttentionPooling on canonical resnext / seed456 in the matched 512x16 20-epoch control
4bae7a0	0.000000	0.000000	0.000000	0.0	crash	formal	CMP-DECISION-EQUAL-RESNEXT-ATTNPOOL-EQUAL-512X16-E20-S456: fixed equal-weight decision fusion with AttentionPooling on canonical resnext / seed456 in the matched 512x16 20-epoch control
paperrepro-C3-retool	0.755319148936170	0.849090909090909	0.684931506849315	0.5	keep	proxy	C3 offline-decision-fusion rerun after closer-to-paper retool; supersedes the earlier joint-like proxy C3 record
b991160	0.000000	0.000000	0.000000	0.0	crash	formal	CMP-DECISION-EQUAL-RESNEXT-ATTNPOOL-LEARNED-512X16-E20-S42: learned decision fusion with AttentionPooling on canonical resnext / seed42 in the matched 512x16 20-epoch control
b991160	0.000000	0.000000	0.000000	0.0	crash	formal	CMP-DECISION-EQUAL-RESNEXT-ATTNPOOL-EQUAL-512X16-E20-S42: fixed equal-weight decision fusion with AttentionPooling on canonical resnext / seed42 in the matched 512x16 20-epoch control
b991160	0.000000	0.000000	0.000000	0.0	crash	formal	CMP-DECISION-EQUAL-RESNEXT-ATTNPOOL-LEARNED-512X16-E20-S123: learned decision fusion with AttentionPooling on canonical resnext / seed123 in the matched 512x16 20-epoch control
b991160	0.000000	0.000000	0.000000	0.0	crash	formal	CMP-DECISION-EQUAL-RESNEXT-ATTNPOOL-EQUAL-512X16-E20-S123: fixed equal-weight decision fusion with AttentionPooling on canonical resnext / seed123 in the matched 512x16 20-epoch control
b991160	0.000000	0.000000	0.000000	0.0	crash	formal	CMP-DECISION-EQUAL-RESNEXT-ATTNPOOL-LEARNED-512X16-E20-S456: learned decision fusion with AttentionPooling on canonical resnext / seed456 in the matched 512x16 20-epoch control
b991160	0.000000	0.000000	0.000000	0.0	crash	formal	CMP-DECISION-EQUAL-RESNEXT-ATTNPOOL-EQUAL-512X16-E20-S456: fixed equal-weight decision fusion with AttentionPooling on canonical resnext / seed456 in the matched 512x16 20-epoch control
0377ed6	0.872340	0.858636	0.857143	4.7	keep	formal	CMP-DECISION-EQUAL-RESNEXT-ATTNPOOL-LEARNED-512X16-E20-S42: learned decision fusion with AttentionPooling on canonical resnext / seed42 in the matched 512x16 20-epoch control
0377ed6	0.808511	0.902727	0.763158	4.6	discard	formal	CMP-DECISION-EQUAL-RESNEXT-ATTNPOOL-EQUAL-512X16-E20-S42: fixed equal-weight decision fusion with AttentionPooling on canonical resnext / seed42 in the matched 512x16 20-epoch control
0377ed6	0.851064	0.895000	0.815789	4.7	discard	formal	CMP-DECISION-EQUAL-RESNEXT-ATTNPOOL-LEARNED-512X16-E20-S123: learned decision fusion with AttentionPooling on canonical resnext / seed123 in the matched 512x16 20-epoch control
0377ed6	0.904255	0.920455	0.896552	4.6	keep	formal	CMP-DECISION-EQUAL-RESNEXT-ATTNPOOL-EQUAL-512X16-E20-S123: fixed equal-weight decision fusion with AttentionPooling on canonical resnext / seed123 in the matched 512x16 20-epoch control
0377ed6	0.840426	0.909091	0.827586	4.7	keep	formal	CMP-DECISION-EQUAL-RESNEXT-ATTNPOOL-LEARNED-512X16-E20-S456: learned decision fusion with AttentionPooling on canonical resnext / seed456 in the matched 512x16 20-epoch control
0377ed6	0.829787	0.867727	0.804878	4.6	discard	formal	CMP-DECISION-EQUAL-RESNEXT-ATTNPOOL-EQUAL-512X16-E20-S456: fixed equal-weight decision fusion with AttentionPooling on canonical resnext / seed456 in the matched 512x16 20-epoch control
c9396b5	0.840426	0.913636	0.814815	12.7	discard	formal	CMP-RESNEXT-DECISION-CONFIRM-7AE19A0-512X16-B6-NW12: direct single-run geometry scale-up of the 7ae19a0 ResNeXt decision-fusion peak from 256x8 to 512x16 while keeping trim_edge_slices=2, batch_size=6, num_workers=12, epochs=15, freeze_layers=3, lr=1e-4, wd=5e-4, dropout=0.25, and clip=2.0 fixed; the batch fit on RTX A6000 but val_acc/val_auc dropped well below the 256x8 anchor
7ae19a0	0.914894	0.952273	0.909091	2.2	discard	formal	CMP-7AE19A0-RESNEXT-DECISION-256X8-S42: requested 3-seed stability rerun of the original 7ae19a0 ResNeXt decision-fusion formal recipe (256x8, trim_edge_slices=2, batch_size=6, num_workers=12, epochs=15, freeze_layers=3, lr=1e-4, wd=5e-4, dropout=0.25, clip=2.0) on V100q/node20 using seed42
7ae19a0	0.861702	0.900455	0.847059	2.2	discard	formal	CMP-7AE19A0-RESNEXT-DECISION-256X8-S123: requested 3-seed stability rerun of the original 7ae19a0 ResNeXt decision-fusion formal recipe (256x8, trim_edge_slices=2, batch_size=6, num_workers=12, epochs=15, freeze_layers=3, lr=1e-4, wd=5e-4, dropout=0.25, clip=2.0) on V100q/node20 using seed123
7ae19a0	0.925532	0.965909	0.917647	2.2	discard	formal	CMP-7AE19A0-RESNEXT-DECISION-256X8-S456: requested 3-seed stability rerun of the original 7ae19a0 ResNeXt decision-fusion formal recipe (256x8, trim_edge_slices=2, batch_size=6, num_workers=12, epochs=15, freeze_layers=3, lr=1e-4, wd=5e-4, dropout=0.25, clip=2.0) on V100q/node20 using seed456
1b84e85	0.936170	0.945909	0.930233	2.1	keep	formal	CMP-7AE19A0-RESNEXT-EQUAL-256X8-S42: requested matched equal-weight control of the 7ae19a0 ResNeXt 256x8 formal recipe on V100q/node20 using seed42; only replaced learned view weighting with fixed 1/3 fusion and val_acc beat the learned-weighting rerun by 0.021277
1b84e85	0.946809	0.975909	0.939759	2.1	keep	formal	CMP-7AE19A0-RESNEXT-EQUAL-256X8-S123: requested matched equal-weight control of the 7ae19a0 ResNeXt 256x8 formal recipe on V100q/node20 using seed123; only replaced learned view weighting with fixed 1/3 fusion and val_acc/val_auc beat the learned-weighting rerun by 0.085106 / 0.075455
1b84e85	0.925532	0.975000	0.923077	2.1	keep	formal	CMP-7AE19A0-RESNEXT-EQUAL-256X8-S456: requested matched equal-weight control of the 7ae19a0 ResNeXt 256x8 formal recipe on V100q/node20 using seed456; only replaced learned view weighting with fixed 1/3 fusion and val_acc tied the learned-weighting rerun while val_auc improved by 0.009091
cc6ebb8	0.808511	0.932273	0.742857	4.6	discard	formal	CMP-FUSION-PATH-RESNEXT-MINIMAL-512X16-E20-S123-MAIN: fresh adaptive main-study fixed trial on the canonical resnext decision 512x16 recipe with model.minimal_fusion_baseline=true and seed123; val_acc trailed matched current learned by 0.042553 despite val_auc +0.021364
4af320c	0.808511	0.863636	0.785714	4.6	discard	formal	CMP-FUSION-PATH-RESNEXT-MINIMAL-512X16-E20-S456-MAIN: fresh adaptive main-study fixed trial on the canonical resnext decision 512x16 recipe with model.minimal_fusion_baseline=true and seed456; val_acc trailed matched current learned by 0.042553 and equal-weight by 0.031915 while val_auc also fell below both controls
ab73d77	0.840426	0.878182	0.805195	4.7	discard	formal	CMP-FUSION-RATIO-RESNEXT-EQPRIOR025-512X16-E20-S42-MAIN: fresh adaptive main-study fixed trial on the canonical resnext decision 512x16 recipe with current learned weighting shrunk 25% toward equal prior; val_acc only tied matched current learned seed42 and val_auc fell by 0.009091 while still trailing equal-weight by 0.042553 / 0.058182
4b599a8	0.851064	0.884091	0.825000	4.7	keep	formal	CMP-FUSION-RATIO-RESNEXT-TEMP2P0-512X16-E20-S42-MAIN: fresh adaptive main-study fixed trial on the canonical resnext decision 512x16 recipe with current learned weighting softened by global fusion temperature 2.0; val_acc improved over matched current learned seed42 by 0.010638 and over the eqprior025 probe by 0.010638 while val_auc only slipped 0.003182 vs current learned
73d68b9	0.840426	0.875909	0.814815	4.7	discard	formal	CMP-FUSION-RATIO-RESNEXT-TEMP2P0-512X16-E20-S123-MAIN: fresh adaptive main-study fixed trial on the canonical resnext decision 512x16 recipe with current learned weighting softened by global fusion temperature 2.0; val_acc fell 0.010638 and val_auc fell 0.035000 vs matched current learned seed123, though it tied equal-weight on val_acc and exceeded equal-weight val_auc by 0.009545
3d780b9	0.872340	0.903636	0.853659	4.7	keep	formal	CMP-FUSION-RATIO-RESNEXT-TEMP1P5-512X16-E20-S123-MAIN: fresh adaptive main-study fixed trial on the canonical resnext decision 512x16 recipe with current learned weighting softened by global fusion temperature 1.5; val_acc improved over matched current learned seed123 by 0.021277 and over temp2.0 by 0.031915 while val_auc stayed above equal-weight and only trailed current learned by 0.007273
15ba788	0.829787	0.908636	0.800000	4.7	discard	formal	CMP-FUSION-RATIO-RESNEXT-TEMP1P5-512X16-E20-S42-MAIN: fresh adaptive main-study fixed trial on the canonical resnext decision 512x16 recipe with current learned weighting softened by global fusion temperature 1.5; val_acc fell 0.010638 vs matched current learned seed42 and 0.021277 vs temp2.0, although val_auc improved by 0.022273 and 0.024545 respectively
6b39d9b	0.829787	0.870455	0.804878	4.7	discard	formal	CMP-FUSION-RATIO-RESNEXT-TEMP1P75-512X16-E20-S42-MAIN: fresh adaptive main-study fixed trial on the canonical resnext decision 512x16 recipe with current learned weighting softened by global fusion temperature 1.75; val_acc stayed at 0.829787 on matched seed42 and trailed current learned by 0.010638, temp2.0 by 0.021277, while val_auc fell below both adjacent temperature probes
24ac323	0.797872	0.878182	0.739726	4.7	discard	formal	CMP-FUSION-PATH-RESNEXT-NOCALIB-512X16-E20-S42-MAIN: fresh adaptive main-study fixed trial on the canonical resnext decision 512x16 recipe with the shared low-rank reliability calibrator removed while keeping the cross-view mixer and matched seed42; val_acc fell below both current learned and equal-weight controls, so calibrator removal is not a viable simplification for this seed
cf392fe	0.840426	0.906818	0.805195	4.6	keep	formal	CMP-FUSION-PATH-RESNEXT-NOMIXER-512X16-E20-S42-MAIN: fresh adaptive main-study fixed trial on the canonical resnext decision 512x16 recipe with ANKLE_DISABLE_FUSION_CROSS_VIEW_MIXER=1 so the shared low-rank reliability calibrator is kept while the cross-view mixer is removed; val_acc tied matched current learned seed42 and val_auc improved by 0.020455 while remaining simpler than the richer reliability path
2cf4602	0.819149	0.905000	0.784810	4.6	discard	formal	CMP-FUSION-PATH-RESNEXT-NOMIXER-512X16-E20-S123-MAIN: direct single-trial Slurm rerun of the canonical resnext decision 512x16 recipe with ANKLE_DISABLE_FUSION_CROSS_VIEW_MIXER=1 on matched seed123; val_acc trailed matched current learned by 0.031915 and equal-weight by 0.021277, so the no-mixer simplification did not hold beyond the seed42 low point
e3cc52b	0.829787	0.879545	0.804878	4.6	discard	formal	CMP-FUSION-PATH-RESNEXT-NOMIXER-512X16-E20-S456-MAIN: direct single-trial Slurm rerun of the canonical resnext decision 512x16 recipe with ANKLE_DISABLE_FUSION_CROSS_VIEW_MIXER=1 on matched seed456; val_acc and val_auc both trailed matched current learned and also stayed below equal-weight, so the no-mixer simplification did not generalize to this seed
8e0bdf4	0.925532	0.948636	0.917647	2.1	keep	formal	CMP-RESNEXT-DECISION-256X8-L0-EQUAL-FORMAL-S42: first current-scaffold 256x8 decision-fusion matched control batch on V100q/node20; equal_weight_fusion=true beat matched learned seed42 on val_acc by 0.021277 while giving up 0.024545 AUC
8e0bdf4	0.925532	0.971818	0.913580	2.1	keep	formal	CMP-RESNEXT-DECISION-256X8-L0-EQUAL-FORMAL-S123: first current-scaffold 256x8 decision-fusion matched control batch on V100q/node20; equal_weight_fusion=true beat matched learned seed123 on val_acc/val_auc by 0.085106 / 0.058636
8e0bdf4	0.914894	0.961364	0.902439	2.1	keep	formal	CMP-RESNEXT-DECISION-256X8-L0-EQUAL-FORMAL-S456: first current-scaffold 256x8 decision-fusion matched control batch on V100q/node20; equal_weight_fusion=true beat matched learned seed456 on val_acc/val_auc by 0.021277 / 0.020000
8e0bdf4	0.904255	0.973182	0.898876	2.2	discard	formal	CMP-RESNEXT-DECISION-256X8-L1-LEARNED-FORMAL-S42: first current-scaffold 256x8 learned-weighting anchor rerun on V100q/node20; higher AUC than matched equal seed42 but lower val_acc by 0.021277 so the learned anchor stays behind on the primary metric
8e0bdf4	0.840426	0.913182	0.835165	2.2	discard	formal	CMP-RESNEXT-DECISION-256X8-L1-LEARNED-FORMAL-S123: first current-scaffold 256x8 learned-weighting anchor rerun on V100q/node20; trailed matched equal seed123 by 0.085106 val_acc and 0.058636 val_auc, making it the largest control failure in the batch
8e0bdf4	0.893617	0.941364	0.888889	2.2	discard	formal	CMP-RESNEXT-DECISION-256X8-L1-LEARNED-FORMAL-S456: first current-scaffold 256x8 learned-weighting anchor rerun on V100q/node20; trailed matched equal seed456 by 0.021277 val_acc and 0.020000 val_auc
03b9211	0.904255	0.958182	0.886076	2.1	discard	formal	CMP-RESNEXT-DECISION-256X8-L2-MINIMAL-FORMAL-S42: matched 256x8 minimal-fusion ablation on V100q/node20 tied the canonical learned seed42 on val_acc but gave back 0.015000 AUC, so it did not improve the learned mainline on this seed
03b9211	0.882979	0.954091	0.857143	2.1	keep	formal	CMP-RESNEXT-DECISION-256X8-L2-MINIMAL-FORMAL-S123: matched 256x8 minimal-fusion ablation on V100q/node20 improved the canonical learned seed123 by 0.042553 val_acc and 0.040909 val_auc, making it the clearest learned-mainline repair in the batch
03b9211	0.914894	0.959545	0.904762	2.1	keep	formal	CMP-RESNEXT-DECISION-256X8-L2-MINIMAL-FORMAL-S456: matched 256x8 minimal-fusion ablation on V100q/node20 improved the canonical learned seed456 by 0.021277 val_acc and 0.018182 val_auc and matched equal-weight accuracy on this seed
27b557c	0.925532	0.977727	0.921348	2.1	keep	formal	CMP-RESNEXT-DECISION-256X8-L3-NO-MIXER-FORMAL-S42: matched 256x8 no-mixer ablation on V100q/node20 improved the canonical learned seed42 by 0.021277 val_acc and 0.004545 val_auc while reaching the strongest single-seed AUC in the batch
27b557c	0.893617	0.939545	0.875000	2.1	keep	formal	CMP-RESNEXT-DECISION-256X8-L3-NO-MIXER-FORMAL-S123: matched 256x8 no-mixer ablation on V100q/node20 improved the canonical learned seed123 by 0.053191 val_acc and 0.026364 val_auc, showing mixer removal generalizes beyond a single low-point seed
27b557c	0.925532	0.971364	0.917647	2.1	keep	formal	CMP-RESNEXT-DECISION-256X8-L3-NO-MIXER-FORMAL-S456: matched 256x8 no-mixer ablation on V100q/node20 improved the canonical learned seed456 by 0.031915 val_acc and 0.030000 val_auc and exceeded matched equal-weight accuracy on this seed
27b557c	0.925532	0.950909	0.915663	2.2	keep	formal	CMP-RESNEXT-DECISION-256X8-L4-NO-CALIBRATOR-FORMAL-S42: matched 256x8 no-calibrator ablation on V100q/node20 repaired the canonical learned seed42 val_acc by 0.021277, but val_auc still fell 0.022273 so the gain is only partial
27b557c	0.840426	0.906818	0.823529	2.2	discard	formal	CMP-RESNEXT-DECISION-256X8-L4-NO-CALIBRATOR-FORMAL-S123: matched 256x8 no-calibrator ablation on V100q/node20 only tied the canonical learned seed123 on val_acc while losing 0.006364 val_auc and 0.011635 val_f1
27b557c	0.925532	0.959545	0.917647	2.2	keep	formal	CMP-RESNEXT-DECISION-256X8-L4-NO-CALIBRATOR-FORMAL-S456: matched 256x8 no-calibrator ablation on V100q/node20 improved the canonical learned seed456 by 0.031915 val_acc and 0.018182 val_auc, but still trailed the stronger no-mixer branch
f84df46	0.925532	0.980000	0.917647	2.3	keep	formal	CMP-RESNEXT-DECISION-256X8-L5-TEMP1P5-FORMAL-S42: matched 256x8 no-mixer plus temperature=1.5 closeout on V100q/node20 tied the L3-no-mixer seed42 val_acc and improved val_auc by 0.002273, but it remained a ranking-side softening rather than a primary-metric gain
f84df46	0.882979	0.947273	0.879121	2.3	discard	formal	CMP-RESNEXT-DECISION-256X8-L5-TEMP1P5-FORMAL-S123: matched 256x8 no-mixer plus temperature=1.5 closeout on V100q/node20 improved seed123 val_auc by 0.007727 but lost 0.010638 val_acc against matched L3-no-mixer, so it did not repair the remaining low-point seed
f84df46	0.936170	0.968636	0.928571	2.3	keep	formal	CMP-RESNEXT-DECISION-256X8-L5-TEMP1P5-FORMAL-S456: matched 256x8 no-mixer plus temperature=1.5 closeout on V100q/node20 improved seed456 val_acc by 0.010638 and val_f1 by 0.010924 versus matched L3-no-mixer, though val_auc dipped 0.002727
f84df46	0.904255	0.982727	0.898876	2.4	discard	formal	CMP-RESNEXT-DECISION-256X8-L5-TEMP2P0-FORMAL-S42: matched 256x8 no-mixer plus temperature=2.0 closeout on V100q/node20 reached the batch-highest AUC but lost 0.021277 val_acc and 0.022472 val_f1 versus matched L3-no-mixer
f84df46	0.861702	0.950000	0.826667	2.4	discard	formal	CMP-RESNEXT-DECISION-256X8-L5-TEMP2P0-FORMAL-S123: matched 256x8 no-mixer plus temperature=2.0 closeout on V100q/node20 failed to repair seed123 and trailed matched L3-no-mixer by 0.031915 val_acc
f84df46	0.925532	0.961818	0.919540	2.4	discard	formal	CMP-RESNEXT-DECISION-256X8-L5-TEMP2P0-FORMAL-S456: matched 256x8 no-mixer plus temperature=2.0 closeout on V100q/node20 only tied the L3-no-mixer seed456 val_acc while losing 0.009545 val_auc, so the temp=2.0 line does not retain mainline value
c3ba210	0.925532	0.975000	0.921348	2.1	discard	formal	FWR-01-RESNEXT-DECISION-256X8-L3-NOMIXER-MAIN-S42-CONTROL: fresh adaptive main-study matched control on node19 tied historical L3-no-mixer seed42 val_acc but trailed its val_auc by 0.002727; view_ablation_summary.json showed full fusion equals single_view_axial and leave_out_coronal/sagittal, while leave_out_axial collapsed to 0.468085
478f371	0.925532	0.975000	0.921348	2.1	discard	formal	FWR-02-RESNEXT-DECISION-256X8-L3-NOMIXER-MAIN-S42-TELEMETRY: analyzed the existing iter_0001 trial_0000 checkpoint and found fusion weights collapsed to axial (mean 0.997426; top-weight axial 94/94); top-weight hit rates were 0.861702 vs pred-margin and 0.882979 vs true-margin, but 3 positive cases still had axial wrong with coronal+sagittal correct while >0.998 weight stayed on axial
27219b2	0.925532	0.975000	0.921348	2.1	discard	formal	FWR-03-RESNEXT-DECISION-256X8-L3-NOMIXER-MAIN-S42-PERTURB: analyzed the existing iter_0001 trial_0000 checkpoint with deterministic axial Gaussian blur (kernel=17, sigma=4.0); perturbed full-fusion val_acc/val_auc fell to 0.617021/0.840455 with 37 prediction flips, but fusion top-weight stayed axial 94/94 and mean axial weight shifted only from 0.997426 to 0.997567, so learned fusion did not migrate away from degraded axial evidence
942b1e9	0.872340	0.935000	0.860465	2.2	discard	formal	DFR-01-RESNEXT-DECISION-256X8-CLASSIFIER-CONTEXT-FORMAL-S42: decision-fusion-only structural repair on node19 kept late fusion fixed while adding per-view recalibration plus light cross-view mixer before view_classifiers under ANKLE_DISABLE_FUSION_CROSS_VIEW_MIXER=1; best summary reached 0.872340/0.935000/0.860465, well below the retained L3-no-mixer seed42 anchor 0.925532/0.977727/0.921348, and training showed unstable late-epoch validation swings
