commit	val_acc	val_auc	val_f1	memory_gb	status	config	description
2749343	0.914894	0.959394	0.908556	2.2	discard	formal	FF-STRUCT-02-GLU-HIDDEN128-3SEED-FORMAL: 设计思路=from the feature-fusion gated-head anchor, reduce only the GLU fusion-head hidden width from 256 to 128 while keeping ResNeXt 256x8, mean pooling, trim2, recalibration, light CrossViewAttention, freeze3, lr/wd/dropout/clip, and seeds 42/123/456 fixed. 预计改进效果=if the anchor head is over-capacity for this data, a narrower GLU could reduce variance and improve 3-seed stability; otherwise it should lose fused-token combination capacity. 实验实际结果=Slurm job 518423 on clean V100q/node21 completed this group; seeds 42/123/456 achieved 0.904255/0.968182/0.891566, 0.957447/0.945000/0.952381, 0.882979/0.965000/0.881720; 3-seed mean=0.914894/0.959394/0.908556, peak_vram max 2.16GB, below gated-head anchor 0.939716/0.975909/0.934415.
2749343	0.925532	0.973182	0.915186	2.2	discard	formal	FF-STRUCT-03-XVIEW-RESIDUAL00625-3SEED-FORMAL: 设计思路=from the feature-fusion gated-head anchor, reduce only the light CrossViewAttention residual scale from 0.125 to 0.0625 while keeping ResNeXt 256x8, mean pooling, trim2, recalibration, GLU head, freeze3, lr/wd/dropout/clip, and seeds 42/123/456 fixed. 预计改进效果=if cross-view mixing is too strong, a smaller residual should preserve useful context while reducing noise propagation; if the anchor scale is already calibrated, reducing it should lose fusion benefit. 实验实际结果=Slurm job 518423 on clean V100q/node21 completed this group; seeds 42/123/456 achieved 0.946809/0.978636/0.943820, 0.925532/0.969545/0.915663, 0.904255/0.971364/0.886076; 3-seed mean=0.925532/0.973182/0.915186, peak_vram max 2.17GB, best of the first three structure rounds but below gated-head anchor 0.939716/0.975909/0.934415.
2749343	0.925532	0.974242	0.918007	2.2	discard	formal	FF-STRUCT-04-XVIEW-RESIDUAL025-3SEED-FORMAL: 设计思路=from the feature-fusion gated-head anchor, increase only the light CrossViewAttention residual scale from 0.125 to 0.25 while keeping ResNeXt 256x8, mean pooling, trim2, recalibration, GLU head, freeze3, lr/wd/dropout/clip, and seeds 42/123/456 fixed. 预计改进效果=if the current mixer under-shares complementary non-dominant view context, a stronger residual should improve fused-token representation before concatenation; otherwise it should amplify noisy cross-view overwrite. 实验实际结果=Slurm job 518423 on clean V100q/node21 completed this group; seeds 42/123/456 achieved 0.936170/0.967727/0.930233, 0.925532/0.972273/0.921348, 0.914894/0.982727/0.902439; 3-seed mean=0.925532/0.974242/0.918007, peak_vram max 2.17GB, below gated-head anchor 0.939716/0.975909/0.934415.
2749343	0.921986	0.959394	0.912104	2.2	discard	formal	FF-STRUCT-05-XVIEW-DIM512-3SEED-FORMAL: 设计思路=from the feature-fusion gated-head anchor, increase only CrossViewAttention internal attention dimension from 256 to 512 while keeping one layer, four heads, residual scale 0.125, ResNeXt 256x8, mean pooling, trim2, recalibration, GLU head, freeze3, lr/wd/dropout/clip, and seeds 42/123/456 fixed. 预计改进效果=if the 256-dim mixer bottleneck loses useful channel detail, full-dimensional cross-view attention should improve feature-level multi-view interaction without changing input geometry or final head capacity. 实验实际结果=Slurm job 518423 completed this final structure group; seeds 42/123/456 achieved 0.914894/0.971364/0.900000, 0.946809/0.954091/0.939759, 0.904255/0.952727/0.896552; 3-seed mean=0.921986/0.959394/0.912104, peak_vram max 2.18GB; all five structure rounds remain below gated-head anchor 0.939716/0.975909/0.934415.
cd5c686	0.939717	0.975909	0.934415	0.0	keep	formal	FF-PAIRWISE-CASE-STATS: 设计思路=paired validation seed-case analysis of gated-head versus minimal concat-MLP feature-fusion baseline using only validation predictions, with patient-cluster bootstrap and no test metrics. 预计改进效果=if recalibration plus xview mixer plus GLU head gives real sample-level benefit, fixed_by_gated should exceed broken_by_gated and every seed should show positive net transition. 实验实际结果=canonical summary mean gated-head 0.939717/0.975909/0.934415 versus minimal 0.914894/0.972121/0.906842, delta +0.024823/+0.003788/+0.027573; checkpoint re-eval paired rows 282 fixed 12 broken 6 net +6 with per-seed net +2/+3/+1, McNemar p 0.237885 and patient-cluster accuracy CI [-0.010638,0.053191]; keep as diagnostic evidence, no new checkpoint.

44196ce	0.932624	0.976364	0.928035	2.2	discard	formal	FF-XVIEW-ROLE-EMBEDDING-3SEED-MAIN: 设计思路=在 feature-fusion gated-head anchor 的 pooled per-view tokens 上加入零初始化 anatomical view-role embedding, 只在 CrossViewAttention mixer 前提供 axial/coronal/sagittal 角色编码, 其余 ResNeXt 256x8/mean pooling/trim2/freeze3/lr/wd/dropout/clip 保持不变. 预计改进效果=显式 view-role token 应让 cross-view attention 学到非对称视角交互, 改善 fused representation 中各切面的角色可分性和 GLU head 的下游 gating 输入稳定性; 若成功应提高 val_acc 而不是只提高 AUC. 实验实际结果=main-study seeds 42/123/456 achieved 0.946809/0.974091/0.941176, 0.936170/0.979091/0.931818, 0.914894/0.975909/0.911111; 3-seed mean 0.932624/0.976364/0.928035, peak_vram max 2.17GB. 权重比例验证=view-role embedding norms were nonzero with axial/coronal/sagittal ratios about 0.289/0.374/0.338, 0.290/0.375/0.334, 0.293/0.378/0.330, so the role tokens trained but did not improve mean val_acc over anchor 0.939716/0.975909/0.934415.
baa8347	0.921986	0.959848	0.914060	2.2	discard	formal	FF-PAIRWISE-TOKEN-RESIDUAL-3SEED-MAIN: 设计思路=在 feature-fusion gated-head anchor 的 CrossViewAttention mixer 后加入零初始化低容量 pairwise view-token residual, 用每个 view token 相对其他 view 的差值和乘积生成小幅 token 修正, 其余 ResNeXt 256x8/mean pooling/trim2/recalibration/GLU head/freeze3/lr/wd/dropout/clip 保持不变. 预计改进效果=如果当前 fused-token GLU head 缺少显式两两视角一致/冲突线索, pairwise residual 应改善 feature-level cross-view interaction, 给融合头更稳定的多视角组合输入并提高 val_acc; 零初始化末层让训练从 anchor 行为开始以降低扰动. 实验实际结果=main-study seeds 42/123/456 achieved 0.925532/0.958182/0.919540, 0.925532/0.956818/0.915663, 0.914894/0.964545/0.906977; 3-seed mean 0.921986/0.959848/0.914060, peak_vram max 2.18GB. 权重比例验证=pairwise residual parameters trained nonzero: final adapter weight norms seed42/123/456 0.229/0.124/0.281 and pair_encoder weight norms 0.188/0.014/0.290, but mean val_acc remained below gated-head anchor 0.939716/0.975909/0.934415.
75ded9f	0.921986	0.974848	0.913594	2.2	discard	formal	FF-VIEW-TOKEN-SCALAR-GATE-3SEED-MAIN: 设计思路=在 feature-fusion gated-head anchor 的 CrossViewAttention mixer 后、GLU fused-token head 前加入零初始化 sample-wise view-token scalar gate, 只学习每个 view token 的低容量标量缩放, 其余 ResNeXt 256x8/mean pooling/trim2/recalibration/light xview mixer/GLU head/freeze3/lr/wd/dropout/clip 保持不变. 预计改进效果=如果当前 GLU head 需要先处理三视角 token 尺度不稳或过度依赖原始 token 幅度, 显式标量门应把融合头容量集中到跨视角组合而不是尺度校准, 使 fused representation 更稳定并提高 val_acc; 零初始化保证从 anchor 行为开始. 实验实际结果=main-study seeds 42/123/456 achieved 0.893617/0.958636/0.883721, 0.936170/0.976364/0.926829, 0.936170/0.989545/0.930233; 3-seed mean 0.921986/0.974848/0.913594, peak_vram max 2.17GB. 权重比例验证=scalar gate trained non-identity with validation scale ratios axial/coronal/sagittal seed42 0.377/0.336/0.287, seed123 0.398/0.332/0.270, seed456 0.409/0.333/0.258, but mean val_acc remained below anchor 0.939716/0.975909/0.934415.
b7a4c37	0.939716	0.973182	0.932670	2.2	discard	formal	FF-VIEW-TOKEN-CHANNEL-GATE-3SEED-MAIN: 设计思路=在 feature-fusion gated-head anchor 的 CrossViewAttention mixer 后、GLU fused-token head 前加入零初始化 sample-wise view-token channel gate, 对每个 mixed view token 做按通道缩放, 其余 ResNeXt 256x8/mean pooling/trim2/recalibration/light xview mixer/GLU head/freeze3/lr/wd/dropout/clip 保持不变. 预计改进效果=如果 fused-token head 的不稳定来自 mixed token 内部通道幅度未校准, channel gate 应比上一轮 scalar gate 更细粒度地稳定 feature-fusion 表征, 让 GLU head 专注跨视角组合并提高 val_acc; 零初始化保证从 anchor 行为开始. 实验实际结果=main-study seeds 42/123/456 achieved 0.946809/0.979545/0.939759, 0.914894/0.956364/0.904762, 0.957447/0.983636/0.953488; 3-seed mean 0.939716/0.973182/0.932670, peak_vram max 2.17GB. 权重比例验证=channel gate trained nonzero with weight norms 0.852/0.948/0.933 and validation axial/coronal/sagittal scale ratios about 0.332/0.336/0.332, 0.334/0.337/0.329, 0.335/0.332/0.333; mean val_acc tied anchor but lower AUC/F1, so discard by tie-break.
5238ee7	0.936170	0.975455	0.930665	2.2	discard	formal	FF-XVIEW-IDENTITY-SKIP-GATE-3SEED-MAIN: 设计思路=在 feature-fusion gated-head anchor 的 CrossViewAttention mixer 后加入零初始化 bounded identity-skip gate, 按样本/通道把 mixed view token 小幅拉回 mixer 前的 recalibrated token, 其余 ResNeXt 256x8/mean pooling/trim2/recalibration/light xview mixer/GLU head/freeze3/lr/wd/dropout/clip 保持不变. 预计改进效果=如果当前 anchor 的少量错误来自 cross-view mixer 过度平均 view-specific channel evidence, identity-skip gate 应保留有用 cross-view context 同时恢复关键 per-view channel, 让 GLU fused-token head 收到更稳定的三视角表征并提高 val_acc; 零初始化保证从 anchor 行为开始. 实验实际结果=main-study seeds 42/123/456 achieved 0.936170/0.977273/0.931818, 0.925532/0.967273/0.917647, 0.946809/0.981818/0.942529; 3-seed mean 0.936170/0.975455/0.930665, peak_vram max 2.17GB. 权重比例验证=identity-skip gate trained nonzero with weight norms 0.852/0.937/0.922 and validation correction-norm ratios axial/coronal/sagittal mean about 0.186/0.177/0.113, but mean val_acc remained below anchor 0.939716/0.975909/0.934415.
9a6458a	0.914894	0.956667	0.901204	2.2	discard	formal	FF-FUSION-LOGIT-RESIDUAL-3SEED-MAIN: 设计思路=在 feature-fusion gated-head anchor 的 GLU fused-token head 旁加入零初始化低秩 logit residual adapter, 读取最终拼接 fused token 并只对二分类 logits 做小幅残差校正, 其余 ResNeXt 256x8/mean pooling/trim2/recalibration/light xview mixer/GLU head/freeze3/lr/wd/dropout/clip 保持不变. 预计改进效果=如果当前少量错误来自 GLU 门控过度压制某些 view-specific channel evidence, 该残差应从 anchor 行为开始保护强 fused-token 证据并降低 head seed 方差, 从而提高 val_acc. 实验实际结果=main-study seeds 42/123/456 achieved 0.936170/0.969091/0.931818, 0.893617/0.943636/0.871795, 0.914894/0.957273/0.900000; 3-seed mean 0.914894/0.956667/0.901204, peak_vram max 2.17GB. 权重比例验证=residual adapter checkpoints contain trained nonzero parameters with first-layer weight norms 0.799/0.811/1.784 and final logit weight norms 0.0037/0.0025/0.0040, but mean val_acc remained below anchor 0.939716/0.975909/0.934415.
7c8430b	0.925532	0.962121	0.916542	2.2	discard	formal	FF-VIEW-TOKEN-DROPOUT-3SEED-MAIN: 设计思路=在 feature-fusion gated-head anchor 的 CrossViewAttention mixer 后、GLU fused-token head 前加入训练期 whole-view token dropout p=0.1, 推理时自动关闭, 其余 ResNeXt 256x8/mean pooling/trim2/recalibration/light xview mixer/GLU head/freeze3/lr/wd/dropout/clip 与 seeds 42/123/456 保持不变. 预计改进效果=如果当前 fused-token GLU head 对某个 mixed view token 依赖过窄或 seed 间 token co-adaptation 较强, 训练期随机屏蔽整视角 token 应迫使 fused representation 学到更冗余的多视角证据组合, 让 GLU head 在缺少单个视角时仍能稳定分类并提高 val_acc. 实验实际结果=main-study seeds 42/123/456 achieved 0.936170/0.957273/0.931818, 0.893617/0.964091/0.878049, 0.946809/0.965000/0.939759; 3-seed mean 0.925532/0.962121/0.916542, peak_vram max 2.17GB. 权重比例验证=本轮不涉及 decision-fusion 权重; trial runtime_env 均确认 ANKLE_FEATURE_ENABLE_VIEW_TOKEN_DROPOUT=1 与 ANKLE_FEATURE_VIEW_TOKEN_DROPOUT_PROB=0.1, 该 regularizer 无可学习权重, 但 seed123 明显退化, mean val_acc 低于 anchor 0.939716/0.975909/0.934415.
211402e	0.939716	0.975758	0.935301	2.2	discard	formal	FF-VIEW-TOKEN-POST-MIXER-AFFINE-3SEED-MAIN: 设计思路=在 feature-fusion gated-head anchor 的 CrossViewAttention mixer 后、GLU fused-token head 前加入 identity-initialized per-view post-mixer affine calibration, 只学习每个 anatomical view token 的全局按通道 scale/bias, 其余 ResNeXt 256x8/mean pooling/trim2/recalibration/light xview mixer/GLU head/freeze3/lr/wd/dropout/clip 与 seeds 42/123/456 保持不变. 预计改进效果=如果当前 fused-token 输入存在 view-specific post-mixer channel scale/bias drift, per-view affine 应比 sample-wise channel gate 更保守地稳定三视角 token 分布, 让 GLU head 接收更一致的融合表征并提高 val_acc; identity 初始化保证从 anchor 行为开始. 实验实际结果=main-study seeds 42/123/456 achieved 0.957447/0.983636/0.954545, 0.936170/0.979091/0.931818, 0.925532/0.964545/0.919540; 3-seed mean 0.939716/0.975758/0.935301, peak_vram max 2.17GB. 权重比例验证=post-mixer affine scale/bias parameters trained nonzero but small; scale norm ratios axial/coronal/sagittal about 0.372/0.346/0.282, 0.367/0.328/0.305, 0.379/0.325/0.296; mean val_acc tied anchor but AUC was lower than 0.975909, so discard by tie-break.
2edba8e	0.936170	0.978333	0.931495	2.2	discard	formal	FF-VIEW-TOKEN-RESIDUAL-CENTERING-3SEED-MAIN: 设计思路=在 feature-fusion gated-head anchor 的 CrossViewAttention mixer 后、GLU fused-token head 前加入零初始化 per-view residual-centering, 用每个 mixed view token 相对样本内三视角均值的残差做小幅可学习校正, 其余 ResNeXt 256x8/mean pooling/trim2/recalibration/light xview mixer/GLU head/freeze3/lr/wd/dropout/clip 与 seeds 42/123/456 保持不变. 预计改进效果=如果当前 fused representation 中三视角共享强背景响应压过局部相对差异, residual-centering 应增强 view-relative feature channels, 让 GLU head 更容易利用跨视角差异而不是重新学习公共成分抵消, 从而有机会提高 val_acc. 实验实际结果=main-study seeds 42/123/456 achieved 0.946809/0.978182/0.941176, 0.936170/0.977727/0.930233, 0.925532/0.979091/0.923077; 3-seed mean 0.936170/0.978333/0.931495, peak_vram max 2.17GB. 权重比例验证=residual-centering delta trained nonzero with norms 0.069/0.057/0.067 and axial/coronal/sagittal norm ratios about 0.366/0.355/0.279, 0.358/0.348/0.294, 0.377/0.339/0.285, but mean val_acc remained below anchor 0.939716/0.975909/0.934415 despite higher AUC.
1ffc814	0.914894	0.955758	0.905896	2.2	discard	formal	FF-VIEW-TOKEN-ADAPTIVE-RESIDUAL-CENTERING-3SEED-MAIN: 设计思路=在 feature-fusion gated-head anchor 的 CrossViewAttention mixer 后、GLU fused-token head 前加入零初始化 sample-conditioned residual-centering gate, 用每个 mixed view token 相对样本内三视角均值的残差预测按样本/通道的小幅校正, 其余 ResNeXt 256x8/mean pooling/trim2/recalibration/light xview mixer/GLU head/freeze3/lr/wd/dropout/clip 与 seeds 42/123/456 保持不变. 预计改进效果=上一轮静态 residual-centering 提升 AUC 但未提升 val_acc, 说明 view-relative signal 可能有用但全局 per-view delta 过钝; adaptive gate 应只在存在样本级跨视角冲突或局部相对证据时放大 view-relative channels, 让 GLU head 更稳定地利用跨视角差异并有机会提高 val_acc; 零初始化保证从 anchor 行为开始. 实验实际结果=main-study seeds 42/123/456 achieved 0.893617/0.967727/0.886364, 0.925532/0.954545/0.915663, 0.925532/0.945000/0.915663; 3-seed mean 0.914894/0.955758/0.905896, peak_vram max 2.17GB. 权重比例验证=本轮不涉及 decision-fusion 权重; adaptive residual-centering gate trained nonzero with first-layer weight norms 0.938/0.877/0.962 and final gate weight norms 0.182/0.188/0.203 for seeds 42/123/456, but seed42 collapsed and mean val_acc/AUC/F1 all stayed below anchor 0.939716/0.975909/0.934415.
2d98c7a	0.921986	0.971061	0.909523	2.2	discard	formal	FF-FUSED-TOKEN-CONTEXT-RESIDUAL-3SEED-MAIN: 设计思路=在 feature-fusion gated-head anchor 的 CrossViewAttention mixer 后、GLU fused-token head 前加入零初始化 global context residual, 每个 mixed view token 读取同一样本三视角均值上下文并生成小幅 token residual, 其余 ResNeXt 256x8/mean pooling/trim2/recalibration/light xview mixer/GLU head/freeze3/lr/wd/dropout/clip 与 seeds 42/123/456 保持不变. 预计改进效果=如果当前 fused-token GLU head 在拼接前缺少显式全局三视角上下文, context residual 应让每个 view token 在保留自身证据的同时获得样本级 multi-view summary, 改善 token 间一致性和 fused representation 稳定性, 让 GLU head 更容易组合互补切面证据并提高 val_acc; 零初始化保证从 anchor 行为开始. 实验实际结果=main-study seeds 42/123/456 achieved 0.936170/0.977273/0.926829, 0.925532/0.958636/0.915663, 0.904255/0.977273/0.886076; 3-seed mean 0.921986/0.971061/0.909523, peak_vram max 2.17GB. 权重比例验证=本轮不涉及 decision-fusion 权重; trial runtime_env 均确认 ANKLE_FEATURE_ENABLE_FUSED_TOKEN_CONTEXT_RESIDUAL=1, context residual adapter trained nonzero with first-layer weight norms 0.364/0.567/0.598 and final-layer weight norms 0.097/0.087/0.087 for seeds 42/123/456, but mean val_acc/AUC/F1 all stayed below anchor 0.939716/0.975909/0.934415.
7b856a2	0.929078	0.968030	0.921503	2.2	discard	formal	FF-IDSKIP-AR-01-3SEED-MAIN: 设计思路=在 identity-skip gate family 内只把 ANKLE_FEATURE_XVIEW_IDENTITY_SKIP_MAX_SCALE 从 0.5 降到 0.25, 保持 ANKLE_FEATURE_ENABLE_XVIEW_IDENTITY_SKIP_GATE=1 与 ResNeXt 256x8/mean pooling/trim2/recalibration/light xview mixer/GLU head/freeze3/lr/wd/dropout/clip/seeds 42/123/456 不变。预计改进效果=更保守的 identity skip 应减少上一版过强 correction 对 mixed tokens 的回拉, 只在 cross-view mixer 过度平均 view-specific channel evidence 时恢复 pre-mixer per-view 证据, 从而让 GLU fused-token head 接收更稳定但仍保留 cross-view context 的三视角表征并有机会提高 val_acc。实验实际结果=main-study seeds 42/123/456 achieved 0.946809/0.973182/0.942529, 0.914894/0.963636/0.902439, 0.925532/0.967273/0.919540; 3-seed mean 0.929078/0.968030/0.921503, peak_vram max 2.17GB. 权重比例验证=gate weight norms 0.819/0.914/0.759; validation correction-to-skip-delta ratios mean axial/coronal/sagittal 0.087/0.085/0.060 and mean abs gate 0.055/0.056/0.045, confirming max_scale=0.25 reduced correction amplitude versus prior 0.5 gate but mean val_acc remained below anchor 0.939716/0.975909/0.934415.
362f72e	0.929078	0.972879	0.919601	2.2	discard	formal	FF-IDSKIP-AR-02-3SEED-MAIN: 设计思路=在 identity-skip gate family 内保持 ANKLE_FEATURE_ENABLE_XVIEW_IDENTITY_SKIP_GATE=1 和 max_scale=0.25, 只新增 ANKLE_FEATURE_XVIEW_IDENTITY_SKIP_NORMALIZE_GATE_INPUT=1, 让 gate 根据归一化后的 skip_delta 方向/通道冲突估计回拉强度, 其余 ResNeXt 256x8/mean pooling/trim2/recalibration/light xview mixer/GLU head/freeze3/lr/wd/dropout/clip/seeds 42/123/456 不变。预计改进效果=如果上一轮保守 identity skip 的问题是 gate 仍受 skip_delta 幅度支配而不是关注 view-specific channel conflict, normalized gate input 应让 fused-token 回拉更依赖相对方向, 在保留 cross-view context 的同时更稳定恢复 pre-mixer per-view evidence, 使 GLU head 获得更一致的三视角表征并有机会提高 val_acc。实验实际结果=main-study seeds 42/123/456 achieved 0.936170/0.973182/0.930233, 0.914894/0.972273/0.900000, 0.936170/0.973182/0.928571; 3-seed mean 0.929078/0.972879/0.919601, peak_vram max 2.17GB. 权重比例验证=gate trained nonzero with weight norms 0.790/0.864/0.936 and validation correction-to-skip-delta ratios axial/coronal/sagittal mean 0.096/0.089/0.072, mean abs gate 0.059/0.058/0.050; normalization made correction slightly stronger than AR-01 but mean val_acc remained below anchor 0.939716/0.975909/0.934415.
d93773f	0.918440	0.963636	0.912677	2.2	discard	formal	FF-IDSKIP-AR-03-3SEED-MAIN: 设计思路=在 identity-skip gate family 内保持 ANKLE_FEATURE_ENABLE_XVIEW_IDENTITY_SKIP_GATE=1、max_scale=0.25 和 normalized gate input, 只新增 ANKLE_FEATURE_XVIEW_IDENTITY_SKIP_INCLUDE_MIXED_CONTEXT=1, 让 gate 输入同时包含 normalized mixed token 与 normalized skip_delta, 其余 ResNeXt 256x8/mean pooling/trim2/recalibration/light xview mixer/GLU head/freeze3/lr/wd/dropout/clip/seeds 42/123/456 不变。预计改进效果=如果 AR-02 只看 skip_delta 导致 gate 无法区分有用 cross-view context 与需要回拉的 view-specific channel, mixed-context input 应让 identity skip 更有条件地恢复 pre-mixer per-view evidence, 使 GLU fused-token head 获得更稳定且不过度回拉的 fused representation, 从而有机会提高 val_acc。实验实际结果=main-study seeds 42/123/456 achieved 0.946809/0.953636/0.939759, 0.914894/0.968182/0.902439, 0.893617/0.969091/0.895833; 3-seed mean 0.918440/0.963636/0.912677, peak_vram max 2.17GB. 权重比例验证=gate trained nonzero with weight norms 1.212/1.143/1.181 and bias norms 0.047/0.041/0.044; validation correction-to-skip-delta ratios axial/coronal/sagittal were seed42 0.162/0.155/0.165, seed123 0.150/0.162/0.192, seed456 0.155/0.129/0.127; mixed-context made correction substantially stronger than AR-02 but mean val_acc/AUC/F1 remained below anchor 0.939716/0.975909/0.934415, closing identity-skip family as negative.
574edd9	0.925532	0.968030	0.915298	2.2	discard	formal	FF-CHGATE-AR-01-3SEED-MAIN: 设计思路=在 channel-gate family 内启用 ANKLE_FEATURE_ENABLE_VIEW_TOKEN_CHANNEL_GATE=1, 并只把 channel gate 的缩放形式从原始 0..2 sigmoid 改为可配置 bounded residual scale; 本轮设置 ANKLE_FEATURE_VIEW_TOKEN_CHANNEL_GATE_MAX_DELTA=0.25, 让 post-mixer mixed view tokens 在 GLU fused-token head 前只能做小幅按通道幅度校准, 其余 ResNeXt 256x8/mean pooling/trim2/recalibration/light xview mixer/GLU head/freeze3/lr/wd/dropout/clip/seeds 42/123/456 不变。预计改进效果=上一版 channel gate 与 anchor val_acc 持平但 AUC/F1 略低, 可能是 scale 范围过宽带来 seed 方差; bounded delta 应保留通道级幅度稳定能力, 同时避免把 mixed token 过度放大或压低, 让 GLU head 更稳定地读取三视角 channel evidence 并有机会提高 val_acc。实验实际结果=main-study seeds 42/123/456 achieved 0.925532/0.973182/0.915663, 0.914894/0.970000/0.900000, 0.936170/0.960909/0.930233; 3-seed mean 0.925532/0.968030/0.915298, peak_vram max 2.17GB. 权重比例验证=channel gate trained nonzero with weight norms 0.799/0.876/0.765 and bias norms 0.041/0.043/0.037; validation scale means axial/coronal/sagittal were seed42 0.990/0.993/0.986, seed123 0.988/0.991/0.982, seed456 0.989/0.987/0.985, with abs scale deltas around 0.044-0.065, confirming bounded small-amplitude correction; mean val_acc/AUC/F1 remained below anchor 0.939716/0.975909/0.934415.
587d586	0.921986	0.969242	0.911973	2.2	discard	formal	FF-CHGATE-AR-02-3SEED-MAIN: 设计思路=在 channel-gate family 内保持 ANKLE_FEATURE_ENABLE_VIEW_TOKEN_CHANNEL_GATE=1 与 bounded max_delta=0.25, 只新增 ANKLE_FEATURE_VIEW_TOKEN_CHANNEL_GATE_PER_VIEW=1, 把 post-mixer channel gate 从三视角共享改为 axial/coronal/sagittal 各自独立的零初始化 gate, 其余 ResNeXt 256x8/mean pooling/trim2/recalibration/light xview mixer/GLU head/freeze3/lr/wd/dropout/clip/seeds 42/123/456 不变。预计改进效果=AR-01 的 shared bounded gate 学到近恒等且三视角 scale means 很接近, 可能无法表达解剖视角特异的 channel 尺度偏置; per-view channel gate 应让每个 mixed view token 在进入 GLU fused-token head 前学习不同通道校准模式, 在保留小幅 bounded correction 的同时提升 fused representation 的角色稳定性并有机会提高 val_acc。实验实际结果=main-study seeds 42/123/456 achieved 0.914894/0.970455/0.909091, 0.914894/0.976364/0.900000, 0.936170/0.960909/0.926829; 3-seed mean 0.921986/0.969242/0.911973, peak_vram max 2.18GB. 权重比例验证=per-view channel gates trained nonzero; gate weight norms axial/coronal/sagittal seed42 0.805/0.855/0.689, seed123 0.817/0.820/0.674, seed456 0.767/0.734/0.593; validation scale means seed42 0.981/0.995/0.981, seed123 0.989/0.991/0.975, seed456 0.993/0.992/0.983 with abs scale deltas about 0.046-0.071, but mean val_acc/AUC/F1 remained below anchor 0.939716/0.975909/0.934415.
