commit	val_acc	val_auc	val_f1	memory_gb	status	config	description
f751082	0.911348	0.964242	0.895973	2.2	discard	formal	FF-CHGATE-AR-03-3SEED-MAIN: 设计思路=在 channel-gate family 内保持 ANKLE_FEATURE_ENABLE_VIEW_TOKEN_CHANNEL_GATE=1、bounded max_delta=0.25 和 per-view gate, 只新增 ANKLE_FEATURE_VIEW_TOKEN_CHANNEL_GATE_BOTTLENECK_DIM=64, 把每个 anatomical view 的 channel gate 从 full 512->512 改为 512->64->512 低秩 bottleneck, 其余 ResNeXt 256x8/mean pooling/trim2/recalibration/light xview mixer/GLU head/freeze3/lr/wd/dropout/clip/seeds 42/123/456 不变。预计改进效果=如果 AR-02 的 per-view full channel gate 自由度过高导致 seed 方差或过强 per-channel 噪声缩放, bottleneck gate 应只保留低秩通道尺度校准模式, 让 GLU fused-token head 前的 mixed tokens 更接近 anchor 但更稳定, 降低融合头尺度补偿负担并有机会提高 val_acc。实验实际结果=main-study seeds 42/123/456 achieved 0.882979/0.961818/0.860759, 0.925532/0.954091/0.913580, 0.925532/0.976818/0.913580; 3-seed mean 0.911348/0.964242/0.895973, peak_vram max 2.17GB. 权重比例验证=bottleneck gates trained nonzero: down-proj norms seed42 0.666/0.772/0.404, seed123 1.056/0.547/0.464, seed456 1.243/1.041/0.898; up-proj norms seed42 0.140/0.121/0.075, seed123 0.155/0.093/0.078, seed456 0.151/0.131/0.109. Validation scale means stayed near 1.000/1.000/1.000, abs scale deltas only about 0.000-0.001, and scale ratios remained 0.333/0.333/0.333, so low-rank channel gate mostly collapsed to identity and mean val_acc/AUC/F1 remained below anchor 0.939716/0.975909/0.934415; channel-gate family 3/3 is negative.
