commit	val_acc	val_auc	val_f1	memory_gb	status	config	description
628294e	0.957447	0.983182	0.954545	0.0	keep	formal	DFR-111-RESNEXT-DECISION-256X8-CONFIRMED-TARGET-POSTHOC-SCAN-ANALYSIS: 设计思路=analysis-only DFR25 seed42 post-hoc upper-bound scan; add sagittal gate-logit residuals on DFR108 confirmed targets or label-free observable FP-risk rules and recompute decision-fusion probabilities without training, to test whether the target set has real upside before more aux mechanisms. 预计改进效果=oracle target-only should show the maximum value of releasing the six confirmed sagittal normal-rescue targets, while observable rules should reveal whether a deployable gate calibration can exceed DFR25 with axial-majority routing and no broken DFR25-correct samples. 实验实际结果=oracle true-target-only residual 6.0 fixes 4 DFR25 FP with 0 broken, offline val_acc/auc/f1 0.978723/0.989091/0.976744 and top-weight 88/0/6; best non-oracle fp_risk rule triggers only CTyin21/95, fixes 2 FP with 0 broken, offline val_acc/auc/f1 0.957447/0.983182/0.954545 and top-weight 92/0/2. Marked keep as analysis-positive upper-bound, not a trained model promotion.
5ff6b7e	0.946809	0.969243	0.942964	0.0	keep	formal	DFR-112-RESNEXT-DECISION-256X8-MULTISEED-POSTHOC-FP-RISK-ANALYSIS: 设计思路=analysis-only model-equivalent logits-level validation of the DFR111 label-free fp-risk sagittal gate residual across DFR25 seeds 42/123/456, using scaled confidence logits and per-view logit margins so no-trigger candidates exactly reproduce stored DFR25 telemetry. 预计改进效果=keep global axial-majority routing while only letting high-precision sagittal-normal FP-risk samples receive sagittal top-weight; seed42 should fix CTyin21/95 with no seed123/456 harm, giving 3-seed learned/posthoc mean accuracy above DFR25 and matched equal-weight without training-time aux pollution. 实验实际结果=fixed DFR111 rule residual 5.0 with axial_min 0.4, axial_max tightened to 0.88, fused_abnormal_min 0.8, sagittal_normal_min 0.55, coronal_abnormal_max 0.525 achieved mean val_acc/auc/f1 0.946809/0.969243/0.942964 versus DFR25 0.939716/0.967727/0.935893; aggregate top-weight moved 237/0/45 to 235/0/47, triggered only CTyin21/95 on seed42, fixed=2/broken=0. Marked keep as analysis-positive posthoc validation, not a trained checkpoint promotion.
77b163f	0.946809	0.969242	0.942964	0.0	keep	formal	DFR-113-RESNEXT-DECISION-256X8-MODEL-INTERNAL-POSTHOC-FP-RISK-GATE-TELEMETRY: 设计思路=implement the DFR112 label-free fp-risk sagittal gate as a default-closed eval-only model branch, then validate existing DFR25 checkpoints through real forward_with_decision_info telemetry rather than offline probability replay. 预计改进效果=model-internal telemetry should exactly reproduce DFR112: only seed42 CTyin21/95 move from axial to sagittal top-weight, aggregate routing stays axial-majority, and no DFR25-correct samples break. 实验实际结果=Slurm RTX A6000 telemetry on seeds 42/123/456 matched the offline rule: seed42 0.957447/0.983182/0.954545 top 92/0/2, seed123 unchanged 0.936170/0.955455/0.931818 top 49/0/45, seed456 unchanged 0.946809/0.969091/0.942529 top 94/0/0; mean 0.946809/0.969242/0.942964, aggregate top 235/0/47, fixed=2/broken=0. Keep as posthoc calibration branch, not a trained checkpoint promotion.
f7e19ac	0.946809	0.969394	0.942964	0.0	discard	formal	DFR-114-RESNEXT-DECISION-256X8-FP-RISK-SAFETY-COVERAGE-AUDIT-ANALYSIS: 设计思路=after DFR113 validated the model-internal fp-risk gate, run an analysis-only label-free neighborhood audit around the trigger boundary to see whether the rule can safely cover more DFR25 errors without test metrics or training. 预计改进效果=if safe expansion exists, it should keep broken=0 while fixing more than the two DFR113 seed42 FP errors and maintain axial-majority routing; otherwise the audit should explain why remaining errors are outside this normal-rescue mechanism. 实验实际结果=300 neighborhood candidates, 41 no-harm; best no-harm relaxed sagittal rule axial_max 0.93 and target_normal_min 0.60 triggered 5 seed42 samples with aggregate top 232/0/50 and AUC 0.969394, but fixed remained 2 and val_acc/f1 stayed 0.946809/0.942964. Frontier attempts to fix 3 errors introduced 2 broken samples and dropped val_acc to 0.943263, so expanded candidate is discard; keep DFR113 strict rule as default calibration branch.
c42a4ff	0.950355	0.971515	0.946965	0.0	keep	formal	DFR-115-RESNEXT-DECISION-256X8-FN-ABNORMAL-RESCUE-AUDIT-ANALYSIS: 设计思路=after DFR114 closed simple FP-risk expansion, run an analysis-only label-free positive-FN abnormal-evidence rescue audit on DFR25 seeds 42/123/456, separate from the sagittal normal-rescue FP mechanism and without test metrics or retraining. 预计改进效果=if a low-coverage no-harm FN rule exists, it should rescue remaining positive samples only when fused abnormal is very low but one view has bounded abnormal evidence, while keeping global learned routing axial-majority and complementing DFR113. 实验实际结果=3505 candidates, 1792 no-harm; best FN-only axial rule residual 6.0 with fused_abnormal_max 0.2, axial_abnormal_min 0.45, max_abnormal_min 0.45, confidence_gap_max 1.0, axial_abnormal_max 0.65 triggered only seed123 CTyang147 and improved mean to 0.943263/0.970000/0.939894 with fixed=1/broken=0. Combined with DFR113 strict FP gate it fixed CTyin21/95 plus CTyang147 with broken=0, aggregate top-weight 236/0/46, and mean 0.950355/0.971515/0.946965. Keep as analysis-positive posthoc combo candidate, not a trained checkpoint promotion.
1a9752a	0.950355	0.971515	0.946965	0.0	keep	formal	DFR-116-RESNEXT-DECISION-256X8-MODEL-INTERNAL-POSTHOC-COMBO-GATE-TELEMETRY: 设计思路=implement DFR115 axial FN abnormal rescue as a default-closed eval-only model branch and validate it together with the DFR113 strict sagittal FP-risk gate through real forward_with_decision_info telemetry on existing DFR25 checkpoints. 预计改进效果=model-internal telemetry should reproduce the DFR115 combo audit: seed42 CTyin21/95 move to sagittal top, seed123 CTyang147 moves to axial top, seed456 unchanged, aggregate routing stays axial-majority and broken=0. 实验实际结果=Slurm RTX A6000 telemetry on seeds 42/123/456 matched the offline combo: seed42 0.957447/0.983182/0.954545 top 92/0/2, seed123 0.946809/0.962273/0.943820 top 50/0/44, seed456 unchanged 0.946809/0.969091/0.942529 top 94/0/0; mean 0.950355/0.971515/0.946965, aggregate top 236/0/46, fixed=3/broken=0. Keep as model-internal posthoc calibration branch, not a trained checkpoint promotion.
078560a	0.950355	0.979091	0.946965	0.0	discard	formal	DFR-117-RESNEXT-DECISION-256X8-COMBO-FRONTIER-AUDIT-ANALYSIS: 设计思路=after DFR116 validated the model-internal combo, run an analysis-only safety/frontier audit that keeps the DFR116 FP+FN combo fixed and adds one extra label-free FP-normal or FN-abnormal residual candidate, without test metrics or training. 预计改进效果=if a safe third-stage mechanism exists, it should keep broken=0 and incremental_broken_vs_combo=0 while increasing fixed beyond DFR116 fixed=3, maintaining axial-majority routing rather than broad averaging. 实验实际结果=3329 distinct extra candidates, 1556 no-harm, 0 improved no-harm; best no-harm coronal FN-family candidate triggered 20 samples and improved AUC to 0.979091 but fixed remained 3, val_acc/f1 stayed 0.950355/0.946965, and routing shifted to 236/20/26 with no additional correct predictions. Best fixed>3 candidate fixed 4 but broke 2 seed42 positives, dropping mean accuracy to 0.946809. Discard as no safe accuracy/F1 expansion; keep DFR116 strict combo.
d1377de	0.950355	0.971515	0.946965	0.0	discard	formal	DFR-118-RESNEXT-DECISION-256X8-VARIANT-EVIDENCE-DRIFT-AUDIT-ANALYSIS: 设计思路=after DFR117 closed threshold expansion, audit existing complete 3-seed formal variants and model-equivalent DFR116 combo replays to see whether any training-side evidence drift fixes remaining combo errors while protecting the three DFR116 fixed samples. 预计改进效果=if a historical training mechanism has useful evidence-side signal, at least one stored or combo-replayed variant should fix DFR116 remaining FP/FN with broken_combo=0 and protected_broken=0, suggesting a bounded training-side follow-up rather than more posthoc thresholds. 实验实际结果=22 complete groups discovered, 20 trained groups and 14 combo replays evaluated; safe stored=0, safe replay=0, improved_safe_stored=0, improved_safe_replay=0. Best stored by safety was DFR62 with fixed_combo=5 but broken_combo=14; best replay was DFR63+combo with fixed_combo=6 but broken_combo=33. Discard as no safe training-side candidate; keep DFR116 strict combo.
fca61d0	0.950355	0.971515	0.946965	0.0	keep	formal	DFR-119-RESNEXT-DECISION-256X8-DFR116-BRANCH-REPRO-PACKAGE-ANALYSIS: 设计思路=after DFR118 found no safe historical training-side candidate, package the retained DFR116 posthoc combo branch into a reproducibility report that checks config/env/checkpoint/split/metrics/top-weight and patient diff against DFR25. 预计改进效果=the report should pass every validation check and make DFR116 reproducible as the current posthoc calibration branch without expanding thresholds or touching test data. 实验实际结果=report status pass; all 9 checks passed; DFR25 reference mean 0.939716/0.967727/0.935893 top 237/0/45, DFR116 combo mean 0.950355/0.971515/0.946965 top 236/0/46, fixed patients exactly seed42 CTyin21/95 and seed123 CTyang147, broken none. Keep as branch consolidation, not checkpoint promotion.
0bf3d71	0.950355	0.971515	0.946965	0.0	discard	formal	DFR-120-RESNEXT-DECISION-256X8-DFR116-FALSE-CASE-REPORT-ANALYSIS: 设计思路=after DFR119 consolidated the DFR116 branch, profile the 14 remaining validation errors by recurrence, evidence pattern, and historical fixer collateral to decide whether any safe model-side mechanism remains. 预计改进效果=if a tractable model-side subset exists, the report should surface safe_training_mechanism_candidates or historically fixable cases with low collateral; otherwise it should redirect the next loop toward data/slice-sampling/per-view sensitivity audit. 实验实际结果=remaining errors 7 FP + 7 FN; evidence buckets strong_axial_fp_above_safety_cap=6, axial_fp_above_safety_cap=1, fn_only_subthreshold=4, fn_single_weak_positive_no_support=2, fn_no_view_weak=1; all 14 were historically fixable by some variants but safe_historical_fixer_case_count=0 and safe_training_candidates empty. Discard as no direct model-side promotion; next step should audit repeated FN sampling/sensitivity and repeated strong axial FP cases.
a2924d4	0.950355	0.971515	0.946965	0.0	keep	formal	DFR-121-RESNEXT-DECISION-256X8-SAMPLING-SENSITIVITY-AUDIT-ANALYSIS: 设计思路=after DFR120 showed no safe model-side candidate, read only validation false-case NIfTI volumes/metadata to audit whether repeated FN/FP cases are driven by sampling coverage, duplicate files, or per-view sensitivity issues. 预计改进效果=if repeated FN cases are data/sampling artifacts, the report should reveal duplicate hashes or identical prediction signatures; if sampling is weak, it should flag baseline 8-slice/trim2 coverage gaps by view. 实验实际结果=8 target patients covering 14 cases; CTyang__CT24yang1__CT2412yang3 and CTyang__CT24yang2__CT2412yang1 have identical NIfTI SHA256 and identical DFR116 prediction signatures for seeds 42/123/456, explaining 6/7 FN as duplicated validation evidence; sampling flags include coronal low_hu300_peak_coverage=6 and coronal baseline_misses_std_top10=4. Keep as data/sampling audit signal; do not change data files without human approval.
415da88	0.960573	0.981550	0.957850	0.0	keep	formal	DFR-122-RESNEXT-DECISION-256X8-DUPLICATE-METRIC-SENSITIVITY-ANALYSIS: 设计思路=after DFR121 found a duplicate positive validation volume, compute read-only duplicate-aware validation metric sensitivity for DFR25 and DFR116 without changing data files or model selection rules. 预计改进效果=if duplicated FN evidence is distorting absolute validation metrics, duplicate weighting/keep-first should raise both branches; DFR116 should retain its relative advantage if the posthoc combo is still real. 实验实际结果=duplicate-aware weighted metrics are diagnostic only: DFR25 rises from 0.939716/0.967727/0.935893 to 0.949821/0.977675/0.946612, DFR116 rises from 0.950355/0.971515/0.946965 to 0.960573/0.981550/0.957850. DFR116 minus DFR25 remains positive and slightly larger under duplicate weighting: acc +0.010752, auc +0.003875, f1 +0.011238. Keep as diagnostic validation-sensitivity report, not a new official model-selection metric.
acc0cc3	0.950355	0.971515	0.946965	0.0	keep	formal	DFR-123-RESNEXT-DECISION-256X8-FULL-METADATA-DUPLICATE-SCAN-ANALYSIS: 设计思路=after DFR122 showed duplicate validation sensitivity, run a read-only full metadata duplicate scan across train/val/test NIfTI paths using same-size SHA256 candidates only, without predictions, test metrics, or data edits. 预计改进效果=if the DFR121 duplicate is isolated, the scan should find only that val-val group; if train-val duplicates exist, validation metric interpretation must include duplicate/leakage sensitivity before further model-side claims. 实验实际结果=376 rows, 376 unique patients, 376 unique resolved NIfTI paths, no missing/invalid paths, no duplicate patient IDs, no same-path multi-patient groups. SHA256 was needed for only 6 same-size candidate paths and found 3 positive content duplicate groups: 2 train-val groups CTyang17/CTyang13 and CTyang29/CTyang19 plus the known val-val group CTyang3/CTyang1; no cross-label duplicates. Keep as data-integrity audit, not a model promotion.
a446411	0.959707	0.982439	0.955819	0.0	keep	formal	DFR-124-RESNEXT-DECISION-256X8-DUPLICATE-LEAKAGE-METRIC-SENSITIVITY-ANALYSIS: 设计思路=after DFR123 found train-val and val-val duplicate content, compute read-only diagnostic validation sensitivity for DFR25 and DFR116 under val-val duplicate weighting, train-val duplicated validation exclusion, and combined clean policies without data edits or test metrics. 预计改进效果=val-val duplicate FN downweighting should raise absolute metrics; excluding train-val duplicated validation positives may reduce absolute metrics if they are easy positives; DFR116 relative delta should remain positive if the posthoc combo is not a duplicate/leakage artifact. 实验实际结果=full delta DFR116-DFR25 is +0.010639/+0.003788/+0.011072; val-val weighted delta +0.010752/+0.003875/+0.011238; train-val val-patient excluded delta +0.010869/+0.003333/+0.011585; combined clean sensitivity DFR25 0.948718/0.979024/0.944052 vs DFR116 0.959707/0.982439/0.955819, delta +0.010989/+0.003415/+0.011767. Keep as diagnostic sensitivity report, not official model-selection metric.
bb0864a	0.959707	0.982439	0.955819	0.0	discard	formal	DFR-125-RESNEXT-DECISION-256X8-COMBINED-CLEAN-FRONTIER-FALSE-CASE-AUDIT-ANALYSIS: 设计思路=after DFR124 showed DFR116 gain is robust under duplicate/leakage clean policies, rerun DFR117 one-extra-posthoc frontier and DFR120 false-case profiling under the combined clean validation mask without data edits or test metrics. 预计改进效果=if duplicate structure hid a safe posthoc expansion, clean-policy improved_no_harm_candidate_count should become positive; otherwise remaining errors should narrow to hard FN/strong axial FP cases and close threshold expansion. 实验实际结果=DFR25 clean 0.948718/0.979024/0.944052 top 229/0/44; DFR116 clean 0.959707/0.982439/0.955819 top 228/0/45, fixed 3 broken 0. Remaining errors 11 = 7 FP + 4 FN across 7 patients. Candidate_count 3329, no_harm 1560, improved_no_harm 0; best no-harm only improves AUC to 0.986504 with no additional fixed cases; best fixed>combo fixes 1 extra but breaks 2. Discard as no safe expansion; next audit clean remaining evidence/sampling.
8cf074c	0.959707	0.982439	0.955819	0.0	keep	formal	DFR-126-RESNEXT-DECISION-256X8-CLEAN-REMAINING-EVIDENCE-SAMPLING-AUDIT-ANALYSIS: 设计思路=after DFR125 closed clean-policy posthoc expansion, inspect the 7 clean remaining patients with DFR116 per-seed evidence, NIfTI metadata, and baseline 8-slice sampling coverage without data edits or test metrics. 预计改进效果=if remaining errors are gate-routing issues, strong non-axial evidence should be visible but downweighted; if not, errors should separate into view-classifier strong FP or weak-evidence/sampling-positive buckets. 实验实际结果=7 patients/11 cases split into negative_strong_axial_classifier_fp=5, positive_recurrent_subthreshold_evidence=1, positive_no_view_reaches_weak_abnormal=1. The 5 negative FP patients have error-seed axial abnormal >=0.90, while positive FN patients show recurrent subthreshold or no-view-weak evidence with coronal sampling coverage flags; sampling flags include coronal low_hu300_peak_coverage=5 and coronal misses std top10=3. Keep as mechanism audit; next axial FP calibration frontier.
01ef7ad	0.959707	0.982439	0.955819	0.0	discard	formal	DFR-127-RESNEXT-DECISION-256X8-AXIAL-FP-CALIBRATION-FRONTIER-ANALYSIS: 设计思路=after DFR126 identified clean remaining negative errors as strong axial classifier FPs, run a read-only axial-risk/non-axial-normal frontier scan on DFR116 clean validation telemetry without test metrics or data edits. 预计改进效果=if a label-free positive-protected axial FP calibration signal exists, candidates should separate clean FP from TN while avoiding clean TP collateral and preserving DFR116 combo metrics. 实验实际结果=clean confusion TN=143/TP=119/FP=7/FN=4; 1830 candidates, zero_positive_candidate_count=0, full_fp_coverage_candidate_count=45. Best full-FP coverage candidate covers all 7 FP but also triggers 51 TP (58 total, FP precision 0.12069). Axial abnormal separates FP from TN (AUC 0.997003) but overlaps/inverts against predicted-positive TP (AUC 0.121248; 113 clean TP high-axial), so label-free axial-risk gating is unsafe. Discard as no safe calibration frontier; next audit trainability of supervised positive-protected axial calibration.
8801f9a	0.959707	0.982439	0.955819	0.0	keep	formal	DFR-128-RESNEXT-DECISION-256X8-AXIAL-CALIBRATION-TRAINABILITY-AUDIT-ANALYSIS: 设计思路=after DFR127 closed label-free axial-risk gating, audit whether supervised positive-protected axial classifier calibration can be expressed through the existing train.py _view_logits/_log_vars CE hook without modifying train.py, data, or test metrics. 预计改进效果=if expressible, next experiment can add a default-closed model-only aux that uses labels through CE to push axial normal up on triggered negatives and down on triggered positives, targeting strong axial FP without broad gate rerouting. 实验实际结果=report status analysis_positive_keep; positive_protected_axial_classifier_aux_feasible=true, can_run_without_train_py_change=true, needs_model_code_before_training=true. Existing gate-rank/nonaxial aux modes do not solve DFR127 because they train routing or nonaxial evidence, not axial classifier calibration. Proposed DFR129 env ANKLE_DECISION_ENABLE_AXIAL_FP_RISK_NORMAL_AUX_LOSS exposes active logits [axial_normal, detach(axial_abnormal)] and detached inactive no-op logits, with low weights 0.0005/0.001/0.0025 because DFR127 trigger is positive-heavy (51 TP vs 7 FP). Keep as trainability audit, not a model promotion.
f0c45ab	0.936170	0.980909	0.933333	2.1	discard	formal	DFR-129-RESNEXT-DECISION-256X8-AXIAL-FP-RISK-NORMAL-AUX-SEED42-MAIN-STUDY: 设计思路=after DFR128 proved train.py can express a positive-protected axial classifier calibration aux, add model-only ANKLE_DECISION_ENABLE_AXIAL_FP_RISK_NORMAL_AUX_LOSS with low weights 0.0005/0.001/0.0025 on the DFR127 high axial-risk trigger. 预计改进效果=reduce strong axial false positives while keeping axial-majority decision fusion and preserving high-axial true positives, ideally moving full-fusion seed42 beyond DFR25 without broad non-axial routing. 实验实际结果=Slurm node16 study completed after runner GPU mapping fix; best trial1 weight 0.001 achieved val_acc/auc/f1=0.936170/0.980909/0.933333, tying DFR25 seed42 accuracy/f1 with higher AUC. Fusion telemetry stayed collapsed at top-weight axial/coronal/sagittal=94/0/0, mean weights=0.9031/0.0487/0.0482; versus DFR25 it fixed CTyin122 but broke CTyin109, top_changed=0, net=0. Discard as no learned-routing improvement and no net accuracy gain.
5b8ccad	0.936170	0.980909	0.933333	0.0	discard	formal	DFR-130-RESNEXT-DECISION-256X8-AXIAL-AUX-DRIFT-AUDIT-ANALYSIS: 设计思路=analysis-only follow-up to DFR129; compare DFR25 seed42, DFR129 best, and DFR116 combo telemetry to determine whether axial-normal train-time calibration produced intended high-risk FP repair or off-target classifier drift. 预计改进效果=if DFR129 is salvageable, the report should show intended trigger coverage on fixed samples, no off-trigger broken samples, and a narrower observable condition that repairs CTyin122 while avoiding CTyin109 and preserving DFR116 fixed targets. 实验实际结果=DFR129 best remained 94/0/0 top-routing with fixed=1 broken=1 net=0 versus DFR25; the DFR25 training trigger covered 34 samples, 32 TP and only 2 FP, confirming positive-heavy pressure. DFR129 fixed CTyin122 but broke off-trigger CTyin109, missed DFR116 fixed CTyin21/95, and had top_changed=0. Marked discard_stop_train_time_axial_aux; do not continue DFR129 weight/threshold sweeps.
